S.N.,Traded Companies,No. Of Transaction,Max Price,Min Price,Closing Price,Traded Shares,Amount,Previous Closing,Difference Rs.
1,Agricultural Development Bank Limited,37,183.00,175.00,180.00,2338.00,418066.00,177.00,3.00
2,Alpine Development Bank Limited,2,96.00,96.00,96.00,180.00,17280.00,97.00,-1.00
3,Arun Valley Hydropower Development Co. Ltd.,37,342.00,323.00,330.00,41410.00,13507016.00,336.00,-6.00
4,Asian Life Insurance Co. Limited,28,252.00,240.00,247.00,15380.00,3730160.00,245.00,2.00
5,Bank of Kathmandu Ltd.,61,607.00,590.00,597.00,13607.00,8118140.00,590.00,7.00
6,Biratlaxmi Bikas Bank Limited,3,147.00,145.00,147.00,237.00,34635.00,143.00,4.00
7,Bishal Bazar Company Limited,1,1772.00,1772.00,1772.00,50.00,88600.00,1808.00,-36.00
8,Business Universal Development Bank Ltd.,3,115.00,114.00,115.00,685.00,78330.00,113.00,2.00
9,Butwal Power Company Limited,13,745.00,707.00,745.00,1016.00,739969.00,705.00,40.00
10,Chhimek Laghubitta Bittiya Sanstha Limited,11,433.00,415.00,422.00,1457.00,612409.00,440.00,-18.00
11,Chilime Hydropower Company Limited,124,1213.00,1161.00,1185.00,19316.00,22731314.00,1165.00,20.00
12,Citizens Bank International Limited,19,218.00,212.00,212.00,1868.00,400997.00,212.00,0.00
13,Country Development Bank Ltd.,51,74.00,72.00,74.00,1980.00,143400.00,72.00,2.00
14,Deprosc Laghubitta Bittiya Sanstha Limited,10,326.00,302.00,326.00,631.00,204996.00,297.00,29.00
15,Deva Bikas Bank Limited,10,83.00,80.00,81.00,1450.00,117400.00,79.00,2.00
16,Everest Bank Limited,33,1166.00,1150.00,1155.00,3503.00,4050973.00,1155.00,0.00
17,First Micro Finance Laghubitta Bittiya Sanstha Limited,7,181.00,180.00,181.00,5895.00,1066125.00,179.00,2.00
18,Gandaki Bikas Bank Limited,14,155.00,152.00,152.00,1420.00,216080.00,150.00,2.00
19,Garima Bikas Bank Limited,15,183.00,175.00,180.00,1840.00,329230.00,181.00,-1.00
20,Gaurishankar Development Bank Ltd.,18,94.00,91.00,93.00,197.00,18313.00,91.00,2.00
21,Global IME Bank Limited,47,277.00,260.00,275.00,8686.00,2324093.00,270.00,5.00
22,Grand Bank Nepal Limited,12,187.00,182.00,185.00,2895.00,533452.00,180.00,5.00
23,Gurans Life Insurance Company Ltd.,31,144.00,136.00,140.00,7930.00,1105900.00,139.00,1.00
24,Hama Merchant & Finance Ltd.,17,67.00,66.00,66.00,1120.00,74900.00,68.00,-2.00
25,Himalayan Bank Limited,19,731.00,719.00,723.00,1935.00,1399207.00,722.00,1.00
26,Himalayan Distillery Limited,1,100.00,100.00,100.00,20.00,2000.00,99.00,1.00
27,Himalayan Finance Limited (Bittiya Sanstha),2,49.42,48.45,49.42,140.00,6851.00,47.50,1.92
28,International Leasing & Finance Co. Ltd.,10,95.00,91.00,93.00,6127.00,565487.00,92.00,1.00
29,Janaki Finance Company Limited,9,392.00,364.00,392.00,1922.00,719516.00,357.00,35.00
30,Janata Bank Nepal Ltd.,81,130.00,126.00,127.00,15370.00,1952665.00,129.00,-2.00
31,Jyoti Bikas Bank Limited,30,91.00,88.00,91.00,710.00,63540.00,88.00,3.00
32,Kamana Sewa Bikas Bank Limited,6,132.00,130.00,130.00,300.00,39280.00,130.00,0.00
33,Karnali Development Bank Limited,15,81.00,81.00,81.00,230.00,18630.00,81.00,0.00
34,Kaski Finance Limited,7,122.00,111.00,122.00,257.00,30426.00,111.00,11.00
35,Kasthamandap Development Bank Limited,17,85.00,83.00,83.00,1184.00,99777.00,84.00,-1.00
36,Kumari Bank Limited,31,251.00,244.00,244.00,3860.00,953219.00,244.00,0.00
37,Laxmi Bank Limited,8,351.00,345.00,345.00,676.00,233982.00,341.00,4.00
38,Life Insurance Corporation (Nepal) Limited,16,1238.00,1199.00,1213.00,460.00,559790.00,1191.00,22.00
39,Lumbini Bank Limited,33,240.00,231.00,240.00,6170.00,1454834.00,232.00,8.00
40,Lumbini Finance Ltd.,1,163.00,163.00,163.00,10.00,1630.00,162.00,1.00
41,Lumbini General Insurance Co. Ltd.,5,120.00,118.00,120.00,860.00,101900.00,118.00,2.00
42,Mahakali Bikas Bank Limited,1,104.00,104.00,104.00,10.00,1040.00,104.00,0.00
43,Mahalaxmi Bikas Bank Ltd.,24,76.00,70.00,74.00,2590.00,188970.00,71.00,3.00
44,Mahalaxmi BikasBank Limited,8,153.00,142.00,150.00,770.00,112534.00,140.00,10.00
45,Miteri Development Bank Limited,10,150.00,144.00,144.00,900.00,132800.00,144.00,0.00
46,Muktinath Bikas Bank Ltd.,9,334.00,320.00,334.00,500.00,161990.00,318.00,16.00
47,Multipurpose Finance Company  Limited,4,201.00,191.00,191.00,70.00,13650.00,211.00,-20.00
48,Nabil Bank Limited,12,1500.00,1486.00,1486.00,897.00,1336894.00,1488.00,-2.00
49,NABIL Bank Limited Promotor Share,2,918.00,900.00,900.00,1348.00,1214784.00,900.00,0.00
50,Narayani National Finance Limited,5,142.00,139.00,139.00,2903.00,407356.00,140.00,-1.00
51,National Life Insurance Co. Ltd.,12,535.00,511.00,514.00,7401.00,3899676.00,540.00,-26.00
52,Neco Insurance Limited,3,120.00,118.00,118.00,570.00,67306.00,116.00,2.00
53,Nepal Bangladesh Bank Limited,51,172.00,161.00,168.00,17988.00,2971463.00,163.00,5.00
54,Nepal Credit And Commercial Bank Limited,9,130.00,125.00,128.00,7110.00,900460.00,125.00,3.00
55,Nepal Doorsanchar Company Limited,17,600.00,591.00,596.00,9170.00,5459510.00,592.00,4.00
56,Nepal Finance Ltd.,3,90.00,89.00,90.00,357.00,31873.00,88.00,2.00
57,Nepal Insurance Co. Ltd.,1,286.00,286.00,286.00,20.00,5720.00,282.00,4.00
58,Nepal Investment Bank Limited,23,560.00,550.00,555.00,3674.00,2038321.00,550.00,5.00
59,Nepal Life Insurance Co. Ltd.,15,1224.00,1177.00,1200.00,2316.00,2789344.00,1200.00,0.00
60,Nepal SBI Bank Limited,10,601.00,590.00,600.00,1561.00,933023.00,579.00,21.00
61,Nerude Laghubitta Bittiya Sanstha Limited,3,442.00,441.00,442.00,200.00,88280.00,450.00,-8.00
62,Nilgiri Bikas Bank Limited,4,139.00,139.00,139.00,40.00,5560.00,139.00,0.00
63,NMB Bank Limited,11,176.00,172.00,176.00,4782.00,829702.00,170.00,6.00
64,Om Development Bank Ltd.,17,198.00,186.00,189.00,2010.00,381579.00,187.00,2.00
65,Oriental Hotels Limited,1,89.00,89.00,89.00,150.00,13350.00,89.00,0.00
66,Pathibhara Bikas Bank Limited,3,102.00,102.00,102.00,200.00,20400.00,102.00,0.00
67,Prabhu  Bank Limited,3,118.00,116.00,116.00,865.00,100590.00,120.00,-4.00
68,Prime Commercial Bank Ltd.,50,242.00,230.00,239.00,11492.00,2750903.00,231.00,8.00
69,Prime Life Insurance Company Limited,34,281.00,278.00,280.00,4338.00,1212778.00,276.00,4.00
70,Prudential Insurance Co. Ltd.,1,155.00,155.00,155.00,10.00,1550.00,158.00,-3.00
71,Public Development Bank Limited,1,72.00,72.00,72.00,10.00,720.00,73.00,-1.00
72,Purnima Bikas Bank Ltd.,3,77.00,76.00,76.00,30.00,2300.00,76.00,0.00
73,Rastriya Beema Company Limited,15,162.00,158.00,160.00,2745.00,439293.00,157.00,3.00
74,Rastriya Beema Company Limited,3,1788.00,1719.00,1788.00,192.00,338793.00,1686.00,102.00
75,Reliable Development Bank Limited,2,150.00,150.00,150.00,189.00,28350.00,148.00,2.00
76,Sagarmatha Insurance Co. Ltd.,7,635.00,621.00,635.00,262.00,164798.00,620.00,15.00
77,Sanima Bank Limited,19,205.00,200.00,205.00,7630.00,1549606.00,200.00,5.00
78,Seti Finance Limited,13,94.00,94.00,94.00,260.00,24440.00,95.00,-1.00
79,Sewa Bikas Bank Limited,9,160.00,156.00,159.00,300.00,47790.00,158.00,1.00
80,Shikhar Insurance Co. Ltd.,3,384.00,370.00,370.00,230.00,85380.00,377.00,-7.00
81,Siddhartha Bank Limited,13,324.00,318.00,318.00,2227.00,713432.00,318.00,0.00
82,Siddhartha Insurance Ltd.,9,167.00,161.00,166.00,1200.00,195610.00,158.00,8.00
83,Soaltee Hotel Limited,1,292.00,292.00,292.00,200.00,58400.00,297.00,-5.00
84,Society Development Bank Ltd.,34,102.00,98.00,102.00,2289.00,225042.00,98.00,4.00
85,Standard Chartered Bank Limited,27,1825.00,1800.00,1809.00,1930.00,3486519.00,1807.00,2.00
86,Subha Laxmi Finance Co. Ltd.,5,84.00,84.00,84.00,100.00,8400.00,85.00,-1.00
87,Summit Laghubitta Bittiya Sanstha Limited,9,205.00,190.00,205.00,1152.00,230381.00,187.00,18.00
88,Sunrise Bank Limited,22,154.00,149.00,152.00,1569.00,238064.00,149.00,3.00
89,Surya Life Insurance Company Limited,23,150.00,137.00,142.00,1090.00,159800.00,141.00,1.00
90,Swabalamban Laghubitta Bittiya Sanstha Limited,5,260.00,250.00,260.00,714.00,184076.00,250.00,10.00
91,Unilever Nepal Limited,1,7672.00,7672.00,7672.00,10.00,76720.00,7828.00,-156.00
92,Western Development Bank Limited,1,95.00,95.00,95.00,12.00,1140.00,94.00,1.00
