S.N.,Traded Companies,No. Of Transaction,Max Price,Min Price,Closing Price,Traded Shares,Amount,Previous Closing,Difference Rs.
1,Ace Development Bank Ltd.,3,127.00,126.00,127.00,178.00,22453.00,125.00,2.00
2,Agricultural Development Bank Limited,89,253.00,242.00,251.00,7230.00,1794525.00,249.00,2.00
3,Alpine Development Bank Limited,10,103.00,98.00,103.00,390.00,39250.00,100.00,3.00
4,Arun Valley Hydropower Development Co. Ltd.,7,323.00,318.00,320.00,640.00,204143.00,323.00,-3.00
5,Asian Life Insurance Co. Limited,35,456.00,440.00,450.00,4262.00,1903725.00,455.00,-5.00
6,Axis Development Bank Limited,18,82.00,77.00,82.00,2930.00,234225.00,77.00,5.00
7,Bagmati Development Bank Ltd.,2,107.00,107.00,107.00,2000.00,214000.00,106.00,1.00
8,Bank of Kathmandu Ltd.,28,542.00,538.00,540.00,4897.00,2640589.00,542.00,-2.00
9,Butwal Power Company Limited,5,806.00,789.00,789.00,1313.00,1044873.00,805.00,-16.00
10,Chhimek Laghubitta Bittiya Sanstha Limited,3,676.00,663.00,663.00,261.00,175136.00,689.00,-26.00
11,Chilime Hydropower Company Limited,23,1245.00,1210.00,1210.00,2715.00,3317393.00,1246.00,-36.00
12,Citizen Investment Trust,1,1466.00,1466.00,1466.00,40.00,58640.00,1466.00,0.00
13,Citizens Bank Internatioal Limited Promoter Share,1,124.00,124.00,124.00,15106.00,1873144.00,124.00,0.00
14,Citizens Bank International Limited,76,260.00,252.00,256.00,12040.00,3074331.00,258.00,-2.00
15,Civil Bank Ltd,52,141.00,140.00,141.00,32911.00,4615140.00,141.00,0.00
16,Clean Energy Development Bank Limited,5,157.00,156.00,156.00,1020.00,159188.00,156.00,0.00
17,Commerz and Trust Bank Nepal Ltd.,120,163.00,154.00,157.00,23239.00,3710179.00,163.00,-6.00
18,Deprosc Laghubitta Bittiya Sanstha Limited,1,579.00,579.00,579.00,10.00,5790.00,569.00,10.00
19,Deva Bikas Bank Limited,7,78.00,76.00,77.00,1572.00,120972.00,78.00,-1.00
20,Everest Bank Limited,13,1560.00,1535.00,1538.00,1200.00,1850474.00,1700.00,-162.00
21,Everest Finance Ltd.,2,100.00,99.00,99.00,130.00,12900.00,99.00,0.00
22,Excel Development Bank Ltd.,5,375.00,365.00,365.00,356.00,132304.00,370.00,-5.00
23,Fewa Finance Co. Ltd.,3,172.00,170.00,170.00,480.00,82000.00,175.00,-5.00
24,Gandaki Bikas Bank Limited,19,152.00,147.00,147.00,1495.00,222909.00,150.00,-3.00
25,Gandaki Bikas BankLimited,1,118.00,118.00,118.00,41.00,4838.00,120.00,-2.00
26,Gaurishankar Development Bank Ltd.,29,100.00,97.00,99.00,372.00,36764.00,99.00,0.00
27,Global IME Bank Limited,44,425.00,396.00,420.00,5539.00,2231203.00,398.00,22.00
28,Grand Bank Nepal Limited,12,173.00,168.00,172.00,5195.00,883628.00,168.00,4.00
29,Gurans Life Insurance Company Ltd.,39,260.00,235.00,245.00,13950.00,3444684.00,246.00,-1.00
30,Hama Merchant & Finance Ltd.,14,71.00,70.00,71.00,980.00,69130.00,72.00,-1.00
31,Himalayan Bank Limited,4,665.00,656.00,665.00,292.00,191891.00,656.00,9.00
32,Himalayan General Insurance Co. Ltd,8,381.00,360.00,362.00,3067.00,1129347.00,354.00,8.00
33,ICFC Finance Limited,12,141.00,140.00,140.00,762.00,106854.00,142.00,-2.00
34,Infrastructure Development Bank Ltd.,8,60.00,57.00,58.00,1184.00,68735.00,61.00,-3.00
35,International Leasing & Finance Co. Ltd.,8,135.00,129.00,129.00,1205.00,158433.00,137.00,-8.00
36,Janaki Finance Company Limited,7,268.00,253.00,253.00,691.00,183433.00,270.00,-17.00
37,Janata Bank Nepal Ltd.,42,164.00,159.00,160.00,9286.00,1486256.00,164.00,-4.00
38,Jyoti Bikas Bank Limited,3,79.00,78.00,79.00,640.00,50530.00,79.00,0.00
39,Kailash Bikas Bank Ltd.,9,180.00,177.00,178.00,3657.00,652132.00,181.00,-3.00
40,Kamana Sewa Bikas Bank Limited,3,154.00,151.00,151.00,90.00,13770.00,157.00,-6.00
41,Kaski Finance Limited,1,108.00,108.00,108.00,48.00,5184.00,110.00,-2.00
42,Kasthamandap Development Bank Limited,8,65.00,63.00,64.00,287.00,18493.00,66.00,-2.00
43,Kumari Bank Limited,38,290.00,281.00,283.00,13543.00,3840886.00,295.00,-12.00
44,Laxmi Bank Limited,5,346.00,341.00,344.00,1502.00,514778.00,353.00,-9.00
45,Life Insurance Corporation (Nepal) Limited,7,1480.00,1439.00,1480.00,794.00,1147030.00,1468.00,12.00
46,Lumbini Bank Limited,9,196.00,194.00,195.00,1644.00,320226.00,196.00,-1.00
47,Lumbini General Insurance Co. Ltd.,22,210.00,202.00,210.00,2516.00,525310.00,204.00,6.00
48,Machhapuchhre Bank Limited,31,242.00,230.00,240.00,11208.00,2626632.00,238.00,2.00
49,Mega  Bank Nepal Ltd.,297,180.00,176.00,178.00,16703.00,2973813.00,179.00,-1.00
50,Miteri Development Bank Limited,5,190.00,185.00,185.00,1158.00,214398.00,193.00,-8.00
51,Muktinath Bikas Bank Ltd.,32,360.00,348.00,360.00,6452.00,2276346.00,359.00,1.00
52,Multipurpose Finance Company  Limited,1,55.00,55.00,55.00,10.00,550.00,56.00,-1.00
53,Nabil Balance Fund 1,12,9.60,9.50,9.50,28478.00,271060.00,9.53,-0.03
54,Nabil Bank Limited,25,1991.00,1965.00,1980.00,2291.00,4523405.00,2000.00,-20.00
55,NABIL Bank Limited Promotor Share,19,1265.00,1250.00,1260.00,4786.00,6013699.00,1266.00,-6.00
56,Narayani National Finance Limited,1,122.00,122.00,122.00,183.00,22326.00,122.00,0.00
57,National Hydro Power Company Limited,1,53.00,53.00,53.00,500.00,26500.00,54.00,-1.00
58,National Life Insurance Co. Ltd.,23,1090.00,1065.00,1066.00,6831.00,7328879.00,1048.00,18.00
59,Nepal Bangladesh Bank Limited,76,378.00,370.00,378.00,28035.00,10437450.00,373.00,5.00
60,Nepal Bank Limited,14,162.00,157.00,160.00,1948.00,311778.00,161.00,-1.00
61,Nepal Consumer Development Bank Ltd.,2,88.00,88.00,88.00,110.00,9680.00,89.00,-1.00
62,Nepal Credit And Commercial Bank Limited,35,284.00,276.00,282.00,14708.00,4113620.00,280.00,2.00
63,Nepal Doorsanchar Company Limited,8,563.00,561.00,563.00,2625.00,1475775.00,565.00,-2.00
64,Nepal Investment Bank Limited,35,834.00,820.00,832.00,10780.00,8933849.00,837.00,-5.00
65,Nepal Life Insurance Co. Ltd.,14,2175.00,2060.00,2101.00,1504.00,3176070.00,2200.00,-99.00
66,Nepal SBI Bank Limited,22,860.00,835.00,860.00,5654.00,4799886.00,845.00,15.00
67,Nerude Laghubitta Bittiya Sanstha Limited,7,715.00,700.00,701.00,967.00,683380.00,710.00,-9.00
68,NIC Asia Bank Ltd.,46,610.00,600.00,610.00,5987.00,3602338.00,611.00,-1.00
69,Nirdhan Utthan Laghubitta Bittiya Sanstha Limited,2,471.00,470.00,470.00,2057.00,966832.00,480.00,-10.00
70,NLG Insurance Company Ltd.,38,490.00,475.00,478.00,3347.00,1621632.00,480.00,-2.00
71,NMB Bank Limited,4,245.00,243.00,243.00,795.00,194037.00,248.00,-5.00
72,Om Development Bank Ltd.,20,199.00,196.00,198.00,1583.00,312378.00,196.00,2.00
73,Oriental Hotels Limited,10,239.00,233.00,233.00,890.00,210580.00,229.00,4.00
74,Prabhu Insurance Ltd.,8,254.00,246.00,250.00,3574.00,889080.00,251.00,-1.00
75,Premier Insurance Company (Nepal) Limited,3,200.00,194.00,194.00,222.00,43640.00,200.00,-6.00
76,Prime Commercial Bank Ltd.,21,289.00,283.00,286.00,3251.00,926444.00,290.00,-4.00
77,Prime Life Insurance Company Limited,28,417.00,390.00,402.00,3042.00,1216446.00,425.00,-23.00
78,Purnima Bikas Bank Ltd.,27,103.00,99.00,102.00,460.00,46830.00,101.00,1.00
79,Sagarmatha Insurance Co. Ltd.,10,800.00,752.00,795.00,1434.00,1133647.00,752.00,43.00
80,Sanima Bank Limited,32,266.00,258.00,260.00,8940.00,2326097.00,264.00,-4.00
81,Sewa Bikas Bank Limited,5,111.00,109.00,109.00,457.00,49935.00,112.00,-3.00
82,Shikhar Insurance Co. Ltd.,17,530.00,509.00,525.00,4464.00,2323956.00,509.00,16.00
83,Shine Resunga Development Bank Ltd.,13,198.00,193.00,193.00,577.00,113010.00,198.00,-5.00
84,Shree Investment Finance Co. Ltd.,2,280.00,275.00,275.00,186.00,51415.00,275.00,0.00
85,Siddhartha Bank Limited,22,386.00,375.00,380.00,6040.00,2279118.00,393.00,-13.00
86,Siddhartha Insurance Ltd.,1,320.00,320.00,320.00,20.00,6400.00,325.00,-5.00
87,Siddhartha Investment Growth Scheme-1,4,10.36,10.30,10.35,6600.00,68281.00,10.40,-0.05
88,Sindhu Bikash Bank Ltd,3,130.00,130.00,130.00,2500.00,325000.00,132.00,-2.00
89,Soaltee Hotel Limited,1,279.00,279.00,279.00,138.00,38502.00,275.00,4.00
90,Standard Chartered Bank Limited,15,1825.00,1765.00,1795.00,1129.00,2012653.00,1830.00,-35.00
91,Subhechha Bikas Bank Limited,7,114.00,110.00,112.00,221.00,24752.00,110.00,2.00
92,Sunrise Bank Limited,36,231.00,226.00,230.00,4486.00,1023502.00,230.00,0.00
93,Supreme Development Bank Ltd.,19,70.00,66.00,70.00,4576.00,309820.00,68.00,2.00
94,Surya Life Insurance Company Limited,4,230.00,226.00,230.00,662.00,150260.00,222.00,8.00
95,Swabalamban Laghubitta Bittiya Sanstha Limited,1,476.00,476.00,476.00,200.00,95200.00,485.00,-9.00
96,Swarojgar Laghu Bitta Bikas Bank Ltd.,10,321.00,315.00,315.00,456.00,145605.00,315.00,0.00
97,Synergy Finance Ltd.,1,80.00,80.00,80.00,590.00,47200.00,0.00,80.00
98,Taragaon Regency Hotel Limited,5,111.00,105.00,111.00,170.00,18030.00,103.00,8.00
99,Tourism Development Bank Limited,2,91.00,91.00,91.00,260.00,23660.00,92.00,-1.00
100,Triveni Bikas Bank Limited,13,183.00,177.00,183.00,7444.00,1323415.00,175.00,8.00
101,United Insurance Co. (Nepal) Ltd.,4,172.00,163.00,172.00,796.00,133024.00,160.00,12.00
102,Western Development Bank Limited,32,101.00,97.00,98.00,816.00,80664.00,99.00,-1.00
103,Zenith Finance Limited,4,88.00,87.00,87.00,284.00,24968.00,87.00,0.00
