S.N.,Traded Companies,No. Of Transaction,Max Price,Min Price,Closing Price,Traded Shares,Amount,Previous Closing,Difference Rs.
1,Agricultural Development Bank Limited,25,242.00,236.00,242.00,2909.00,699241.00,241.00,1.00
2,Alpine Development Bank Limited,2,99.00,98.00,99.00,20.00,1970.00,99.00,0.00
3,Arun Valley Hydropower Development Co. Ltd.,5,335.00,323.00,335.00,87.00,28677.00,318.00,17.00
4,Asian Life Insurance Co. Limited,4,212.00,205.00,212.00,319.00,66466.00,205.00,7.00
5,Bank of Kathmandu Ltd.,36,687.00,661.00,668.00,6115.00,4100830.00,668.00,0.00
6,Bishal Bazar Company Limited,1,1864.00,1864.00,1864.00,10.00,18640.00,1828.00,36.00
7,Business Universal Development Bank Ltd.,1,100.00,100.00,100.00,5572.00,557200.00,100.00,0.00
8,Chilime Hydropower Company Limited,23,1090.00,1084.00,1088.00,1548.00,1684734.00,1085.00,3.00
9,Citizen Investment Trust,2,1340.00,1332.00,1332.00,50.00,66680.00,1332.00,0.00
10,Citizens Bank International Limited,15,267.00,260.00,267.00,1598.00,420406.00,264.00,3.00
11,Clean Energy Development Bank Limited,1,161.00,161.00,161.00,68.00,10948.00,160.00,1.00
12,Country Development Bank Ltd.,3,65.00,64.00,65.00,100.00,6480.00,63.00,2.00
13,Deprosc Laghubitta Bittiya Sanstha Limited,3,298.00,293.00,293.00,147.00,43756.00,304.00,-11.00
14,Everest Bank Limited,24,1385.00,1370.00,1370.00,2782.00,3827241.00,1375.00,-5.00
15,Everest Bank Limited Con. Pref.,1,780.00,780.00,780.00,16.00,12480.00,780.00,0.00
16,First Micro Finance Laghubitta Bittiya Sanstha Limited,1,150.00,150.00,150.00,148.00,22200.00,151.00,-1.00
17,Gandaki Bikas Bank Limited,7,132.00,128.00,132.00,1220.00,159240.00,130.00,2.00
18,Garima Bikas Bank Limited,23,173.00,162.00,173.00,700.00,116560.00,162.00,11.00
19,Global IME Bank Limited,23,424.00,409.00,424.00,6088.00,2511468.00,414.00,10.00
20,Grand Bank Nepal Limited,20,202.00,196.00,202.00,5992.00,1189700.00,199.00,3.00
21,Guheshowori Merchant Bank & Finance Co. Ltd.,2,202.00,198.00,198.00,7051.00,1396310.00,237.00,-39.00
22,Gurans Life Insurance Company Ltd.,6,143.00,135.00,143.00,460.00,62980.00,137.00,6.00
23,Himalayan Bank Limited,3,758.00,755.00,756.00,515.00,389580.00,766.00,-10.00
24,Infrastructure Development Bank Ltd.,9,72.00,71.00,72.00,879.00,62538.00,73.00,-1.00
25,International Leasing & Finance Co. Ltd.,6,120.00,119.00,119.00,4637.00,554683.00,118.00,1.00
26,Janaki Finance Company Limited,6,270.00,260.00,265.00,1329.00,348800.00,265.00,0.00
27,Janata Bank Nepal Ltd.,13,172.00,166.00,171.00,4496.00,762055.00,169.00,2.00
28,Jyoti Bikas Bank Limited,17,81.00,80.00,81.00,1320.00,106600.00,80.00,1.00
29,Kabeli Bikas Bank Limited,2,121.00,121.00,121.00,40.00,4840.00,121.00,0.00
30,Kailash Bikas Bank Ltd.,1,140.00,140.00,140.00,170.00,23800.00,142.00,-2.00
31,Kamana Sewa Bikas Bank Limited,3,119.00,118.00,118.00,420.00,49860.00,120.00,-2.00
32,Kasthamandap Development Bank Limited,7,81.00,80.00,81.00,988.00,79184.00,79.00,2.00
33,Kumari Bank Limited,3,260.00,260.00,260.00,230.00,59800.00,260.00,0.00
34,Laxmi Bank Limited,3,370.00,360.00,360.00,1374.00,495080.00,366.00,-6.00
35,Lumbini Bank Limited,12,250.00,243.00,250.00,3283.00,806623.00,243.00,7.00
36,Lumbini Bikas Bank Ltd.,14,93.00,89.00,89.00,2130.00,191760.00,91.00,-2.00
37,Lumbini Finance Ltd.,1,187.00,187.00,187.00,38.00,7106.00,190.00,-3.00
38,Machhapuchhre Bank Limited,21,231.00,226.00,228.00,8707.00,1987695.00,231.00,-3.00
39,Mahakali Bikas Bank Limited,1,97.00,97.00,97.00,40.00,3880.00,98.00,-1.00
40,Mahalaxmi Bikas Bank Ltd.,11,69.00,67.00,69.00,400.00,27090.00,67.00,2.00
41,Mahalaxmi BikasBank Limited,2,128.00,128.00,128.00,540.00,69120.00,128.00,0.00
42,Manjushree Finance Ltd.,1,111.00,111.00,111.00,11250.00,1248750.00,110.00,1.00
43,Miteri Development Bank Limited,1,135.00,135.00,135.00,48.00,6480.00,137.00,-2.00
44,Muktinath Bikas Bank Ltd.,11,290.00,276.00,279.00,1060.00,296910.00,280.00,-1.00
45,Multipurpose Finance Company  Limited,10,87.00,87.00,87.00,200.00,17400.00,87.00,0.00
46,Nabil Bank Limited,19,1624.00,1600.00,1622.00,1449.00,2337256.00,1620.00,2.00
47,Narayani National Finance Limited,1,138.00,138.00,138.00,273.00,37674.00,137.00,1.00
48,Neco Insurance Limited,1,119.00,119.00,119.00,24.00,2856.00,117.00,2.00
49,Nepal Bangladesh Bank Limited,235,275.00,255.00,274.00,141811.00,37942902.00,255.00,19.00
50,Nepal Bank Limited,13,930.00,902.00,920.00,1557.00,1424722.00,919.00,1.00
51,Nepal Credit And Commercial Bank Limited,16,190.00,181.00,190.00,4680.00,862060.00,181.00,9.00
52,Nepal Doorsanchar Company Limited,8,651.00,645.00,650.00,2470.00,1602885.00,650.00,0.00
53,Nepal Investment Bank Limited,14,773.00,763.00,769.00,2538.00,1949746.00,765.00,4.00
54,Nepal Life Insurance Co. Ltd.,3,1665.00,1650.00,1665.00,187.00,309825.00,1650.00,15.00
55,Nepal SBI Bank Limited,7,846.00,816.00,822.00,527.00,432085.00,830.00,-8.00
56,Nilgiri Bikas Bank Limited,2,143.00,141.00,141.00,20.00,2840.00,145.00,-4.00
57,Nirdhan Utthan Laghubitta Bittiya Sanstha Limited,1,226.00,226.00,226.00,47.00,10622.00,230.00,-4.00
58,NMB Bank Limited,12,270.00,259.00,267.00,3090.00,821918.00,254.00,13.00
59,Om Development Bank Ltd.,4,168.00,163.00,168.00,1150.00,187710.00,166.00,2.00
60,Oriental Hotels Limited,10,132.00,131.00,131.00,710.00,93480.00,132.00,-1.00
61,Prabhu  Bank Limited,8,138.00,135.00,136.00,5450.00,739250.00,135.00,1.00
62,Prime Commercial Bank Ltd.,21,312.00,306.00,307.00,3632.00,1117931.00,307.00,0.00
63,Prime Life Insurance Company Limited,3,295.00,294.00,295.00,108.00,31812.00,294.00,1.00
64,Rastriya Beema Company Limited,2,138.00,136.00,138.00,193.00,26534.00,138.00,0.00
65,Reliable Development Bank Limited,1,130.00,130.00,130.00,27.00,3510.00,128.00,2.00
66,Sahayogi Bikas Bank Limited,1,289.00,289.00,289.00,1939.00,560371.00,285.00,4.00
67,Sanima Bank Limited,33,267.00,261.00,266.00,7767.00,2052527.00,262.00,4.00
68,Seti Finance Limited,2,90.00,90.00,90.00,80.00,7200.00,91.00,-1.00
69,Sewa Bikas Bank Limited,3,134.00,132.00,132.00,142.00,18804.00,136.00,-4.00
70,Shangrila Development Bank Ltd.,9,131.00,127.00,130.00,1340.00,173610.00,127.00,3.00
71,Shikhar Insurance Co. Ltd.,1,464.00,464.00,464.00,30.00,13920.00,459.00,5.00
72,Siddhartha Bank Limited,1,320.00,320.00,320.00,34.00,10880.00,316.00,4.00
73,Siddhartha Bank Limited Promoter Share,2,110.00,110.00,110.00,22894.00,2518340.00,108.00,2.00
74,Siddhartha Insurance Ltd.,1,208.00,208.00,208.00,210.00,43680.00,208.00,0.00
75,Siddhartha Investment Growth Scheme-1,14,12.26,11.50,12.26,36830.00,425818.00,11.71,0.55
76,Soaltee Hotel Limited,1,280.00,280.00,280.00,220.00,61600.00,282.00,-2.00
77,Society Development Bank Ltd.,13,65.00,62.00,62.00,7828.00,491906.00,63.00,-1.00
78,Standard Chartered Bank Limited,13,1955.00,1940.00,1950.00,1222.00,2377582.00,1979.00,-29.00
79,Subha Laxmi Finance Co. Ltd.,8,76.00,72.00,76.00,210.00,15640.00,71.00,5.00
80,Sunrise Bank Limited,19,183.00,180.00,183.00,1475.00,266799.00,180.00,3.00
81,Supreme Development Bank Ltd.,8,70.00,69.00,69.00,1478.00,102022.00,70.00,-1.00
82,Surya Life Insurance Company Limited,17,166.00,165.00,165.00,510.00,84300.00,166.00,-1.00
83,Swabalamban Laghubitta Bittiya Sanstha Limited,2,333.00,332.00,333.00,146.00,48599.00,327.00,6.00
84,Taragaon Regency Hotel Limited,6,102.00,98.00,98.00,170.00,16810.00,100.00,-2.00
85,Tinau Development Bank Limited,1,113.00,113.00,113.00,10.00,1130.00,111.00,2.00
86,Tourism Development Bank Limited,1,92.00,92.00,92.00,300.00,27600.00,93.00,-1.00
87,Triveni Bikas Bank Limited,1,160.00,160.00,160.00,45.00,7200.00,159.00,1.00
88,Unilever Nepal Limited,1,9702.00,9702.00,9702.00,30.00,291060.00,9900.00,-198.00
89,Union Finance Co. Ltd.,9,96.00,91.00,96.00,259.00,24215.00,90.00,6.00
90,Unique Finance Ltd.,11,92.00,87.00,91.00,330.00,29780.00,87.00,4.00
91,Western Development Bank Limited,5,84.00,83.00,83.00,144.00,12036.00,82.00,1.00
92,Zenith Finance Limited,5,97.00,95.00,97.00,110.00,10574.00,94.00,3.00
