S.N.,Traded Companies,No. Of Transaction,Max Price,Min Price,Closing Price,Traded Shares,Amount,Previous Closing,Difference Rs.
1,Agricultural Development Bank Limited,3,457.00,455.00,457.00,81.00,36915.00,461.00,-4.00
2,Apex Development Bank Ltd.,8,141.00,137.00,140.00,2339.00,324851.00,142.00,-2.00
3,Araniko Development Bank Limited,3,189.00,187.00,187.00,1022.00,191314.00,192.00,-5.00
4,Arun Valley Hydropower Development Co. Ltd.,10,281.00,275.00,281.00,2583.00,714735.00,275.00,6.00
5,Asian Life Insurance Co. Limited,10,1010.00,1000.00,1000.00,1829.00,1830552.00,1002.00,-2.00
6,Bank of Kathmandu Ltd.,18,585.00,580.00,580.00,4842.00,2814018.00,583.00,-3.00
7,Barun Hydropower Co. Ltd.,62,378.00,357.00,368.00,620.00,226400.00,385.00,-17.00
8,Bhargav Bikash Bank Ltd.,2,320.00,320.00,320.00,200.00,64000.00,320.00,0.00
9,Biratlaxmi Bikas Bank Limited,2,400.00,395.00,395.00,577.00,230640.00,400.00,-5.00
10,Business Universal Development Bank Ltd.,4,262.00,257.00,257.00,1638.00,425164.00,267.00,-10.00
11,Butwal Power Company Limited,2,603.00,603.00,603.00,500.00,301500.00,615.00,-12.00
12,Central Finance Co. Ltd.,1,245.00,245.00,245.00,49.00,12005.00,242.00,3.00
13,Century Commercial Bank Ltd.,22,295.00,290.00,295.00,10435.00,3053491.00,297.00,-2.00
14,Chhimek Laghubitta Bittiya Sanstha Limited,2,1680.00,1680.00,1680.00,780.00,1310400.00,1680.00,0.00
15,Chilime Hydropower Company Limited,31,1371.00,1350.00,1370.00,3807.00,5179501.00,1361.00,9.00
16,Citizens Bank International Limited,36,521.00,513.00,515.00,12070.00,6220271.00,523.00,-8.00
17,Civil Bank Ltd,4,260.00,254.00,260.00,1771.00,454580.00,260.00,0.00
18,Deprosc Laghubitta Bittiya Sanstha Limited,3,1680.00,1670.00,1680.00,120.00,201400.00,1672.00,8.00
19,Deva Bikas Bank Limited,1,190.00,190.00,190.00,50.00,9500.00,190.00,0.00
20,Everest Bank Limited,47,2718.00,2685.00,2715.00,7363.00,19915795.00,2730.00,-15.00
21,Everest Finance Ltd.,3,171.00,168.00,168.00,410.00,70080.00,174.00,-6.00
22,Everest Insurance Co. Ltd.,5,740.00,725.00,725.00,1170.00,856400.00,735.00,-10.00
23,First Micro Finance Laghubitta Bittiya Sanstha Limited,4,540.00,530.00,535.00,2032.00,1089880.00,530.00,5.00
24,Gandaki Bikas Bank Limited,7,306.00,297.00,300.00,2573.00,769592.00,303.00,-3.00
25,Gandaki Bikas BankLimited,14,406.00,385.00,403.00,1684.00,672050.00,390.00,13.00
26,Garima Bikas Bank Limited,6,336.00,325.00,332.00,1840.00,609125.00,330.00,2.00
27,Global IME Bank Limited,43,403.00,391.00,391.00,11928.00,4695279.00,401.00,-10.00
28,Goodwill Finance Limited,7,205.00,197.00,200.00,975.00,193937.00,209.00,-9.00
29,Gurans Life Insurance Company Ltd.,2,536.00,527.00,536.00,132.00,70464.00,536.00,0.00
30,Hama Merchant & Finance Ltd.,17,174.00,168.00,174.00,2941.00,503878.00,176.00,-2.00
31,Hathway Finance Company Limited,9,110.00,108.00,108.00,520.00,57120.00,112.00,-4.00
32,Himalayan Bank Limited,14,1213.00,1180.00,1210.00,3488.00,4162120.00,1210.00,0.00
33,Infrastructure Development Bank Ltd.,13,194.00,185.00,190.00,7389.00,1407442.00,195.00,-5.00
34,International Development Bank Ltd,5,206.00,201.00,206.00,2491.00,508146.00,209.00,-3.00
35,International Leasing & Finance Co. Ltd.,12,228.00,223.00,224.00,9024.00,2023686.00,226.00,-2.00
36,Jyoti Bikas Bank Limited,6,175.00,172.00,172.00,432.00,74654.00,172.00,0.00
37,Kailash Bikas Bank Ltd.,1,327.00,327.00,327.00,20.00,6540.00,321.00,6.00
38,Kalika Laghubitta Bittiya Sanstha Ltd,15,1301.00,1250.00,1250.00,1054.00,1332592.00,1325.00,-75.00
39,Kalinchowk Development Bank Ltd.,9,184.00,181.00,181.00,97.00,17647.00,182.00,-1.00
40,Kasthamandap Development Bank Limited,4,178.00,174.00,178.00,2455.00,434433.00,175.00,3.00
41,Kumari Bank Limited,22,404.00,400.00,404.00,5689.00,2285317.00,406.00,-2.00
42,Laxmi Bank Limited,10,491.00,485.00,486.00,2642.00,1288050.00,499.00,-13.00
43,Laxmi Laghubitta Bittiya Sanstha Ltd.,2,815.00,815.00,815.00,651.00,530565.00,816.00,-1.00
44,Life Insurance Corporation (Nepal) Limited,8,3200.00,3150.00,3200.00,451.00,1422176.00,3150.00,50.00
45,Lumbini Bank Limited,7,377.00,372.00,375.00,2612.00,976325.00,372.00,3.00
46,Lumbini General Insurance Co. Ltd.,2,365.00,365.00,365.00,399.00,145635.00,361.00,4.00
47,Mahalaxmi Bikas Bank Ltd.,10,144.00,142.00,144.00,2771.00,395382.00,144.00,0.00
48,Mahalaxmi BikasBank Limited,2,290.00,285.00,290.00,210.00,60850.00,290.00,0.00
49,Mirmire Microfinance Development Bank Ltd.,2,572.00,561.00,572.00,20.00,11330.00,550.00,22.00
50,Miteri Development Bank Limited,4,564.00,542.00,542.00,400.00,220100.00,575.00,-33.00
51,Mithila LaghuBitta Bittiya Sanstha Limited,1,994.00,994.00,994.00,12.00,11928.00,1014.00,-20.00
52,Muktinath Bikas Bank Ltd.,14,675.00,666.00,675.00,2722.00,1823983.00,679.00,-4.00
53,Nabil Balance Fund 1,5,13.00,12.80,12.80,5394.00,69912.30,13.06,-0.26
54,Nabil Bank Limited,10,2289.00,2266.00,2270.00,1031.00,2344215.00,2310.00,-40.00
55,NABIL Bank Limited Promotor Share,19,1685.00,1665.00,1685.00,5020.00,8406475.00,1685.00,0.00
56,National Hydro Power Company Limited,12,115.00,110.00,111.00,7690.00,854550.00,113.00,-2.00
57,National Life Insurance Co. Ltd.,16,2099.00,2065.00,2099.00,2599.00,5419718.00,2095.00,4.00
58,Nepal Bangladesh Bank Limited,73,600.00,590.00,595.00,18908.00,11281662.00,596.00,-1.00
59,Nepal Bangladesh Bank Limited Promoter Share,1,0.00,0.00,0.00,67121.00,6712100.00,220.00,0.00
60,Nepal Bank Limited,23,261.00,252.00,253.00,10587.00,2717180.00,259.00,-6.00
61,Nepal Credit And Commercial Bank Limited,6,405.00,400.00,400.00,2940.00,1177620.00,406.00,-6.00
62,Nepal Doorsanchar Company Limited,8,650.00,641.00,650.00,2905.00,1873030.00,650.00,0.00
63,Nepal Investment Bank Limited,28,728.00,718.00,720.00,7925.00,5708907.00,733.00,-13.00
64,Nepal Investment Bank Ltd. Promoter Share,8,612.00,603.00,610.00,1500.00,911900.00,615.00,-5.00
65,Nepal Life Insurance Co. Ltd.,13,3140.00,3112.00,3120.00,948.00,2962086.00,3199.00,-79.00
66,Nepal SBI Bank Limited,19,1300.00,1268.00,1300.00,3563.00,4577492.00,1281.00,19.00
67,Nerude Laghubitta Bittiya Sanstha Limited,6,1680.00,1630.00,1630.00,1277.00,2126310.00,1665.00,-35.00
68,NIBL Samriddhi Fund 1,5,9.70,9.50,9.70,41279.00,395040.13,9.49,0.21
69,NIC Asia Bank Ltd.,13,868.00,860.00,868.00,3149.00,2723829.00,878.00,-10.00
70,Nirdhan Utthan Laghubitta Bittiya Sanstha Limited,1,1820.00,1820.00,1820.00,55.00,100100.00,1850.00,-30.00
71,NLG Insurance Company Ltd.,9,680.00,670.00,680.00,647.00,438730.00,666.00,14.00
72,NMB Sulav Investment Fund-1,2,9.90,9.90,9.90,9000.00,89100.00,9.90,0.00
73,Oriental Hotels Limited,1,566.00,566.00,566.00,55.00,31130.00,555.00,11.00
74,Premier Insurance Company (Nepal) Limited,4,480.00,472.00,472.00,445.00,213240.00,480.00,-8.00
75,Prime Commercial Bank Ltd.,11,568.00,560.00,566.00,2598.00,1458971.00,568.00,-2.00
76,Prime Life Insurance Company Limited,10,1245.00,1212.00,1245.00,2189.00,2674968.00,1250.00,-5.00
77,Progressive Finance Limited,6,164.00,155.00,155.00,510.00,80700.00,161.00,-6.00
78,Reliable Development Bank Limited,1,295.00,295.00,295.00,40.00,11800.00,300.00,-5.00
79,Ridi Hydropower Development Company Ltd.,9,387.00,373.00,375.00,196.00,74117.00,380.00,-5.00
80,RMDC Laghubitta Bittiya Sanstha Ltd.,3,638.00,635.00,635.00,375.00,238875.00,625.00,10.00
81,Sagarmatha  Finance Limited,7,193.00,187.00,188.00,333.00,62704.00,187.00,1.00
82,Sagarmatha Insurance Co. Ltd.,4,802.00,790.00,790.00,1039.00,827302.00,818.00,-28.00
83,Sana Kisan Bikas Laghubitta Bittiya Sanstha Limited,19,1800.00,1761.00,1785.00,1059.00,1888058.00,1825.00,-40.00
84,Sanima Bank Limited,29,633.00,622.00,631.00,25462.00,15864318.00,634.00,-3.00
85,Sanima Mai Hydropower Ltd.,6,755.00,730.00,730.00,1192.00,883360.00,760.00,-30.00
86,Shangrila Development Bank Ltd.,7,389.00,389.00,389.00,471.00,183219.00,396.00,-7.00
87,Shrijana Finance  (Bittaya Sanstha),1,71.00,71.00,71.00,985.00,69935.00,70.00,1.00
88,Siddhartha Bank Limited,13,685.00,661.00,675.00,3657.00,2469170.00,685.00,-10.00
89,Siddhartha Investment Growth Scheme-1,2,15.60,15.40,15.40,30000.00,464000.00,15.75,-0.35
90,Soaltee Hotel Limited,8,420.00,410.00,410.00,2200.00,913000.00,415.00,-5.00
91,Society Development Bank Ltd.,7,132.00,129.00,132.00,10261.00,1332430.00,130.00,2.00
92,Standard Chartered Bank Limited,18,2511.00,2475.00,2511.00,1945.00,4865953.00,2500.00,11.00
93,Subhechha Bikas Bank Limited,1,290.00,290.00,290.00,27.00,7830.00,294.00,-4.00
94,Sunrise Bank Limited,7,378.00,365.00,370.00,2203.00,805976.00,382.00,-12.00
95,Supreme Development Bank Ltd.,10,203.00,199.00,200.00,4265.00,850676.00,201.00,-1.00
96,Surya Life Insurance Company Limited,4,661.00,648.00,655.00,368.00,240440.00,674.00,-19.00
97,Swabalamban Laghubitta Bittiya Sanstha Limited,16,1977.00,1952.00,1975.00,2123.00,4161501.00,1977.00,-2.00
98,Tinau Development Bank Limited,4,330.00,318.00,318.00,422.00,136878.00,336.00,-18.00
99,Tourism Development Bank Limited,2,260.00,256.00,260.00,680.00,174680.00,256.00,4.00
100,Unilever Nepal Limited,1,26520.00,26520.00,26520.00,10.00,265200.00,26000.00,520.00
101,Unique Finance Ltd.,1,148.00,148.00,148.00,10.00,1480.00,146.00,2.00
102,United Finance Ltd.,1,309.00,309.00,309.00,200.00,61800.00,315.00,-6.00
103,Western Development Bank Limited,2,301.00,301.00,301.00,42.00,12642.00,304.00,-3.00
