S.N.,Traded Companies,No. Of Transaction,Max Price,Min Price,Closing Price,Traded Shares,Amount,Previous Closing,Difference Rs.
1,Agricultural Development Bank Limited,41,612.00,590.00,596.00,7995.00,4812885.00,600.00,-4.00
2,Alpine Development Bank Limited,4,418.00,410.00,411.00,556.00,228655.00,410.00,1.00
3,Api Power Company Ltd.,21,590.00,563.00,569.00,573.00,330221.00,578.00,-9.00
4,Arun Valley Hydropower Development Co. Ltd.,12,298.00,293.00,298.00,2655.00,783348.00,296.00,2.00
5,Asian Life Insurance Co. Limited,9,1743.00,1716.00,1716.00,1746.00,3023149.00,1738.00,-22.00
6,Bank of Kathmandu Ltd.,257,710.00,692.00,698.00,66240.00,46245204.00,698.00,0.00
7,Barun Hydropower Co. Ltd.,11,382.00,360.00,365.00,410.00,152160.00,375.00,-10.00
8,Bhargav Bikash Bank Ltd.,1,545.00,545.00,545.00,100.00,54500.00,545.00,0.00
9,Bottlers Nepal (Balaju) Limited,1,1660.00,1660.00,1660.00,100.00,166000.00,1660.00,0.00
10,Bottlers Nepal (Terai) Limited,4,5175.00,5000.00,5000.00,150.00,754910.00,5280.00,-280.00
11,Butwal Power Company Limited,7,715.00,683.00,683.00,2011.00,1420701.00,718.00,-35.00
12,Century Commercial Bank Ltd.,60,430.00,418.00,421.00,9731.00,4119582.00,422.00,-1.00
13,Chhimek Laghubitta Bittiya Sanstha Limited,20,2050.00,2011.00,2026.00,2004.00,4087025.00,2050.00,-24.00
14,Chilime Hydropower Company Limited,61,1209.00,1182.00,1195.00,8187.00,9798072.00,1198.00,-3.00
15,Citizen Investment Trust,9,4595.00,4500.00,4511.00,438.00,1988775.00,4518.00,-7.00
16,Citizens Bank International Limited,96,535.00,525.00,525.00,18050.00,9570590.00,528.00,-3.00
17,Civil Bank Ltd,293,324.00,321.00,323.00,96574.00,31130191.00,321.00,2.00
18,Civil Laghubitta Bittiya Sanstha Ltd.,5,900.00,858.00,858.00,550.00,481980.00,900.00,-42.00
19,Cosmos Development Bank Ltd.,1,460.00,460.00,460.00,250.00,115000.00,462.00,-2.00
20,Deprosc Laghubitta Bittiya Sanstha Limited,13,2764.00,2705.00,2705.00,1623.00,4448980.00,2710.00,-5.00
21,Deva Bikas Bank Limited,13,352.00,346.00,350.00,2200.00,768382.00,351.00,-1.00
22,Everest Bank Limited,302,3725.00,3695.00,3706.00,46810.00,173458190.00,3690.00,16.00
23,Everest Insurance Co. Ltd.,3,1970.00,1955.00,1955.00,600.00,1176000.00,2002.00,-47.00
24,Excel Development Bank Ltd.,7,675.00,668.00,675.00,1971.00,1325169.00,665.00,10.00
25,Garima Bikas Bank Limited,11,430.00,398.00,430.00,1507.00,646978.00,391.00,39.00
26,Global IME Bank Limited,65,488.00,483.00,485.00,11394.00,5534719.00,487.00,-2.00
27,Global IME Laghubitta Bittiya Sanstha Ltd.,52,2050.00,1950.00,1950.00,886.00,1768763.00,2000.00,-50.00
28,Global IME Samunnat Scheme-1,2,11.45,11.41,11.41,18986.00,217009.98,11.45,-0.04
29,Goodwill Finance Limited,1,380.00,380.00,380.00,500.00,190000.00,377.00,3.00
30,Grameen Bikas Laghubitta Bittiya Sanstha Ltd.,13,695.00,660.00,693.00,1560.00,1041280.00,695.00,-2.00
31,Guheshowori Merchant Bank & Finance Co. Ltd.,4,300.00,295.00,295.00,1550.00,461100.00,300.00,-5.00
32,Gurans Life Insurance Company Ltd.,15,895.00,886.00,890.00,2677.00,2384300.00,897.00,-7.00
33,Hamro Bikas Bank Ltd.,4,520.00,510.00,520.00,867.00,450340.00,510.00,10.00
34,Himalayan Bank Limited,16,1370.00,1330.00,1340.00,1307.00,1758130.00,1355.00,-15.00
35,Himalayan General Insurance Co. Ltd,12,1855.00,1820.00,1830.00,1060.00,1953841.00,1845.00,-15.00
36,Hydorelectricity Investment and Development Company Ltd,224,281.00,272.00,281.00,43991.00,12166152.00,279.00,2.00
37,ICFC Finance Limited,8,295.00,291.00,292.00,763.00,223462.00,290.00,2.00
38,IME General Insurance Ltd.,2,176.00,173.00,176.00,20.00,3490.00,170.00,6.00
39,Janaki Finance Company Limited,10,351.00,347.00,347.00,3125.00,1092950.00,353.00,-6.00
40,Janautthan Samudayic Laghubitta Bittya Sanstha Limited,20,2900.00,2820.00,2840.00,200.00,570080.00,2868.00,-28.00
41,Jebils Finance Ltd.,3,265.00,265.00,265.00,1150.00,304750.00,270.00,-5.00
42,Jyoti Bikas Bank Limited,46,387.00,377.00,381.00,5083.00,1941283.00,384.00,-3.00
43,Kabeli Bikas Bank Limited,2,605.00,604.00,605.00,48.00,29016.00,613.00,-8.00
44,Kailash Bikas Bank Ltd.,20,606.00,603.00,605.00,2979.00,1800446.00,605.00,0.00
45,Kalika Laghubitta Bittiya Sanstha Ltd,6,1887.00,1820.00,1820.00,250.00,460610.00,1850.00,-30.00
46,Kamana Sewa Bikas Bank Limited,18,420.00,414.00,416.00,2446.00,1016101.00,420.00,-4.00
47,Kanchan Development Bank Limited,6,560.00,540.00,550.00,2611.00,1440940.00,559.00,-9.00
48,Kankai Bikas Bank Ltd.,4,650.00,637.00,637.00,850.00,546900.00,640.00,-3.00
49,Kisan Lagubitta Bittiya Sanstha Limited,37,4077.00,3771.00,4000.00,620.00,2455680.00,3845.00,155.00
50,Kumari Bank Limited,252,618.00,608.00,610.00,54607.00,33391312.00,605.00,5.00
51,Lalitpur Finance Ltd.,2,222.00,220.00,220.00,400.00,88600.00,225.00,-5.00
52,Laxmi Bank Limited,45,832.00,825.00,825.00,7412.00,6131363.00,825.00,0.00
53,Laxmi Laghubitta Bittiya Sanstha Ltd.,8,1700.00,1638.00,1638.00,428.00,719940.00,1670.00,-32.00
54,Laxmi Value Fund-1,1,12.85,12.85,12.85,581.00,7465.85,12.60,0.25
55,Life Insurance Corporation (Nepal) Limited,7,3235.00,3150.00,3200.00,1112.00,3533216.00,3218.00,-18.00
56,Lumbini Bikas Bank Ltd.,111,227.00,220.00,223.00,29862.00,6644488.00,224.00,-1.00
57,Lumbini Finance Ltd.,5,415.00,410.00,415.00,1616.00,667324.00,413.00,2.00
58,Lumbini General Insurance Co. Ltd.,61,1800.00,1760.00,1760.00,11756.00,20811475.00,1760.00,0.00
59,Machhapuchhre Bank Limited,93,555.00,521.00,546.00,21495.00,11715798.00,548.00,-2.00
60,Mahalaxmi Bikas Bank Ltd.,16,344.00,335.00,335.00,1703.00,580299.00,338.00,-3.00
61,Mahila Sahayatra Microfinance Bittiya Sanstha Ltd.,26,1169.00,1053.00,1053.00,650.00,709940.00,1170.00,-117.00
62,Manjushree Finance Ltd.,7,420.00,416.00,420.00,850.00,356180.00,415.00,5.00
63,Mega  Bank Nepal Ltd.,58,500.00,493.00,493.00,20196.00,10004184.00,502.00,-9.00
64,Mirmire Microfinance Development Bank Ltd.,4,3180.00,3121.00,3121.00,120.00,375230.00,3213.00,-92.00
65,Mission Development Bank Ltd.,1,623.00,623.00,623.00,254.00,158242.00,635.00,-12.00
66,Miteri Development Bank Limited,2,600.00,590.00,590.00,93.00,55070.00,600.00,-10.00
67,Muktinath Bikas Bank Ltd.,40,990.00,977.00,983.00,5532.00,5443594.00,995.00,-12.00
68,Nabil Balance Fund 1,5,21.80,21.10,21.80,10934.00,234177.70,21.52,0.28
69,Nabil Bank Limited,48,1725.00,1710.00,1716.00,4705.00,8079617.00,1722.00,-6.00
70,NABIL Bank Limited Promotor Share,11,1244.00,1231.00,1231.00,2927.00,3613414.00,1240.00,-9.00
71,NagBeli LaghuBitta Bikas Bank Ltd.,27,5000.00,4880.00,4980.00,1084.00,5364305.00,4794.00,186.00
72,National Hydro Power Company Limited,17,167.00,162.00,163.00,13680.00,2247650.00,166.00,-3.00
73,National Life Insurance Co. Ltd.,67,3380.00,3320.00,3369.00,11704.00,39221379.00,3310.00,59.00
74,Naya Sarathi Laghubitta Bittiya Sanstha Limited,3,1373.00,1372.00,1372.00,139.00,190757.00,1371.00,1.00
75,Neco Insurance Limited,25,2205.00,2180.00,2180.00,3940.00,8648700.00,2185.00,-5.00
76,Nepal Bangladesh Bank Limited,103,830.00,810.00,810.00,12093.00,9851136.00,818.00,-8.00
77,Nepal Bank Limited,130,508.00,482.00,490.00,40639.00,20215137.00,494.00,-4.00
78,Nepal Community Development Bank Ltd.,1,404.00,404.00,404.00,20.00,8080.00,397.00,7.00
79,Nepal Doorsanchar Company Limited,19,693.00,676.00,685.00,3534.00,2414632.00,676.00,9.00
80,Nepal Insurance Co. Ltd.,8,1216.00,1192.00,1192.00,668.00,800976.00,1240.00,-48.00
81,Nepal Investment Bank Limited,101,785.00,772.00,775.00,16965.00,13212541.00,774.00,1.00
82,Nepal Investment Bank Ltd. Promoter Share,4,681.00,675.00,675.00,550.00,373550.00,668.00,7.00
83,Nepal Life Insurance Co. Ltd.,21,3731.00,3700.00,3700.00,3421.00,12740206.00,3700.00,0.00
84,Nepal SBI Bank Limited,30,1680.00,1658.00,1665.00,3340.00,5556035.00,1670.00,-5.00
85,Nerude Laghubitta Bittiya Sanstha Limited,11,1820.00,1810.00,1820.00,2177.00,3951640.00,1809.00,11.00
86,Ngadi Group Power Ltd.,49,341.00,335.00,336.00,1645.00,555751.00,344.00,-8.00
87,NIBL Samriddhi Fund 1,3,12.51,12.51,12.51,15000.00,187650.00,12.75,-0.24
88,NIC Asia Bank Ltd.,92,592.00,570.00,570.00,15963.00,9282123.00,586.00,-16.00
89,Nirdhan Utthan Laghubitta Bittiya Sanstha Limited,17,1570.00,1500.00,1540.00,1172.00,1790490.00,1500.00,40.00
90,NLG Insurance Company Ltd.,21,2115.00,2100.00,2101.00,3829.00,8070035.00,2110.00,-9.00
91,NMB  Microfinance Bittiya Sanstha Ltd.,8,2065.00,2060.00,2060.00,165.00,340005.00,2020.00,40.00
92,NMB Bank Limited,114,710.00,699.00,707.00,29778.00,20958219.00,699.00,8.00
93,NMB Sulav Investment Fund-1,4,13.53,13.00,13.30,9810.00,129775.00,13.00,0.30
94,Oriental Hotels Limited,3,485.00,481.00,485.00,962.00,466350.00,490.00,-5.00
95,Prabhu Insurance Ltd.,28,1500.00,1466.00,1470.00,3001.00,4430130.00,1510.00,-40.00
96,Premier Insurance Company (Nepal) Limited,6,2240.00,2190.00,2215.00,509.00,1118260.00,2230.00,-15.00
97,Prime Commercial Bank Ltd.,73,609.00,598.00,600.00,9017.00,5438412.00,600.00,0.00
98,Prime Life Insurance Company Limited,7,2195.00,2161.00,2165.00,661.00,1439669.00,2180.00,-15.00
99,Progressive Finance Limited,4,229.00,225.00,225.00,40010.00,9002790.00,225.00,0.00
100,Prudential Insurance Co. Ltd.,11,1550.00,1520.00,1540.00,1280.00,1967540.00,1535.00,5.00
101,Purnima Bikas Bank Ltd.,1,473.00,473.00,473.00,100.00,47300.00,464.00,9.00
102,Raptibheri Bikas Bank Ltd.,16,493.00,485.00,486.00,1787.00,873350.00,478.00,8.00
103,Rastriya Beema Company Limited,8,13526.00,12990.00,13200.00,610.00,8066280.00,13800.00,-600.00
104,Rastriya Beema Company Limited Promoter Share,3,12505.00,12500.00,12500.00,158.00,1975500.00,12726.00,-226.00
105,Reliance Finance Ltd.,3,314.00,314.00,314.00,30.00,9420.00,314.00,0.00
106,Ridi Hydropower Development Company Ltd.,11,267.00,252.00,257.00,1850.00,476724.00,262.00,-5.00
107,RMDC Laghubitta Bittiya Sanstha Ltd.,42,780.00,755.00,760.00,4435.00,3409435.00,779.00,-19.00
108,Sagarmatha  Finance Limited,10,527.00,518.00,521.00,1608.00,841994.00,529.00,-8.00
109,Sagarmatha Insurance Co. Ltd.,2,2210.00,2205.00,2210.00,300.00,662500.00,2215.00,-5.00
110,Sajha Bikas Bank Ltd.,2,290.00,290.00,290.00,56.00,16240.00,294.00,-4.00
111,Sana Kisan Bikas Laghubitta Bittiya Sanstha Limited,35,1667.00,1639.00,1644.00,5214.00,8583565.00,1635.00,9.00
112,Sanima Bank Limited,131,607.00,600.00,601.00,23608.00,14255124.00,605.00,-4.00
113,Sanima Mai Hydropower Ltd.,29,930.00,918.00,918.00,3389.00,3126386.00,930.00,-12.00
114,Saptakoshi Development Bank Ltd.,1,494.00,494.00,494.00,10.00,4940.00,485.00,9.00
115,Seti Finance Limited,4,250.00,250.00,250.00,600.00,150000.00,255.00,-5.00
116,Sewa Bikas Bank Limited,13,345.00,339.00,339.00,3100.00,1061800.00,345.00,-6.00
117,Shangrila Development Bank Ltd.,11,450.00,445.00,450.00,2829.00,1271265.00,450.00,0.00
118,Shikhar Insurance Co. Ltd.,69,4145.00,4020.00,4065.00,8055.00,32788804.00,4050.00,15.00
119,Shine Resunga Development Bank Ltd.,14,586.00,573.00,586.00,1512.00,878346.00,591.00,-5.00
120,Siddhartha Bank Limited,139,1090.00,1065.00,1066.00,28207.00,30305815.00,1075.00,-9.00
121,Siddhartha Development Bank Ltd.,29,485.00,477.00,478.00,7889.00,3786311.00,481.00,-3.00
122,Siddhartha Equity Orineted Scheme,1,12.65,12.65,12.65,12000.00,151800.00,12.75,-0.10
123,Siddhartha Insurance Ltd.,25,2560.00,2510.00,2510.00,3142.00,7958335.00,2508.00,2.00
124,Sindhu Bikash Bank Ltd,3,435.00,427.00,427.00,345.00,147850.00,432.00,-5.00
125,Soaltee Hotel Limited,11,422.00,412.00,412.00,4648.00,1927649.00,420.00,-8.00
126,Standard Chartered Bank Limited,69,3215.00,3165.00,3170.00,6987.00,22279197.00,3213.00,-43.00
127,Sunrise Bank Limited,54,550.00,535.00,540.00,8574.00,4645584.00,540.00,0.00
128,Surya Life Insurance Company Limited,11,892.00,880.00,880.00,1046.00,926430.00,875.00,5.00
129,Suryodaya Womi Laghubitta Bittiya Sanstha Limited,3,1850.00,1850.00,1850.00,36.00,66600.00,1850.00,0.00
130,Swabalamban Laghubitta Bittiya Sanstha Limited,5,2393.00,2375.00,2385.00,743.00,1775875.00,2390.00,-5.00
131,Synergy Finance Ltd.,2,173.00,172.00,173.00,350.00,60500.00,170.00,3.00
132,Taragaon Regency Hotel Limited,5,255.00,252.00,255.00,2000.00,507500.00,252.00,3.00
133,Tinau Development Bank Limited,4,482.00,473.00,482.00,362.00,173890.00,490.00,-8.00
134,Tourism Development Bank Limited,5,526.00,516.00,522.00,790.00,408900.00,506.00,16.00
135,Unilever Nepal Limited,3,30100.00,30100.00,30100.00,100.00,3010000.00,29655.00,445.00
136,Union Finance Co. Ltd.,3,190.00,187.00,187.00,148.00,27940.00,190.00,-3.00
137,United Insurance Co. (Nepal) Ltd.,32,1387.00,1360.00,1360.00,5075.00,6931285.00,1370.00,-10.00
138,Vijaya laghubitta Bittiya Sanstha Ltd.,14,1210.00,1174.00,1174.00,1350.00,1599620.00,1195.00,-21.00
139,Western Development Bank Limited,5,340.00,331.00,340.00,1425.00,478121.00,330.00,10.00
