S.N.,Traded Companies,No. Of Transaction,Max Price,Min Price,Closing Price,Traded Shares,Amount,Previous Closing,Difference Rs.
1,Agricultural Development Bank Limited,75,449.00,438.00,443.00,23326.00,10279553.00,444.00,-1.00
2,Api Power Company Ltd.,77,673.00,635.00,644.00,3683.00,2358800.00,660.00,-16.00
3,Arun Kabeli Power Ltd.,168,375.00,364.00,368.00,13588.00,5010685.00,375.00,-7.00
4,Arun Valley Hydropower Development Co. Ltd.,36,270.00,265.00,268.00,9752.00,2601307.00,265.00,3.00
5,Asian Life Insurance Co. Limited,37,1595.00,1579.00,1590.00,4066.00,6432103.00,1593.00,-3.00
6,Bank of Kathmandu Ltd.,68,480.00,474.00,478.00,8530.00,4064231.00,477.00,1.00
7,Barun Hydropower Co. Ltd.,21,245.00,241.00,241.00,397.00,96254.00,245.00,-4.00
8,Bhargav Bikash Bank Ltd.,3,281.00,280.00,280.00,730.00,205000.00,286.00,-6.00
9,Bottlers Nepal (Terai) Limited,6,7107.00,6965.00,6965.00,80.00,560220.00,7252.00,-287.00
10,Butwal Power Company Limited,2,640.00,636.00,636.00,79.00,50284.00,640.00,-4.00
11,Central Finance Co. Ltd.,2,196.00,196.00,196.00,47.00,9212.00,200.00,-4.00
12,Century Commercial Bank Ltd.,81,258.00,253.00,255.00,10645.00,2712864.00,257.00,-2.00
13,Chhimek Laghubitta Bittiya Sanstha Limited,17,1630.00,1600.00,1630.00,1334.00,2148100.00,1600.00,30.00
14,Chhyangdi Hydropower Ltd.,30,214.00,209.00,211.00,628.00,132194.00,217.00,-6.00
15,Chilime Hydropower Company Limited,48,795.00,775.00,785.00,8692.00,6795284.00,784.00,1.00
16,Citizen Investment Trust,22,3950.00,3900.00,3905.00,3093.00,12157575.00,3921.00,-16.00
17,Citizens Bank International Limited,87,380.00,372.00,380.00,17650.00,6611474.00,380.00,0.00
18,City Express Finance Co. Limited,25,230.00,206.00,226.00,8200.00,1761800.00,218.00,8.00
19,Civil Bank Ltd,64,252.00,247.00,250.00,16448.00,4082220.00,252.00,-2.00
20,Civil Laghubitta Bittiya Sanstha Ltd.,22,1319.00,1307.00,1319.00,1505.00,1972186.00,1319.00,0.00
21,Deprosc Laghubitta Bittiya Sanstha Limited,41,1410.00,1396.00,1410.00,3464.00,4854810.00,1400.00,10.00
22,Deva Bikas Bank Limited,75,271.00,262.00,263.00,20506.00,5427954.00,266.00,-3.00
23,Dibyashwori Hydropower Ltd.,27,186.00,182.00,182.00,415.00,76403.00,189.00,-7.00
24,Everest Bank Limited,47,1375.00,1367.00,1374.00,3024.00,4142707.00,1367.00,7.00
25,Everest Bank Limited Con. Pref.,5,810.00,810.00,810.00,84.00,68040.00,810.00,0.00
26,Everest Insurance Co. Ltd.,8,2619.00,2605.00,2619.00,395.00,1030830.00,2600.00,19.00
27,Excel Development Bank Ltd.,8,710.00,692.00,706.00,1431.00,1011592.00,701.00,5.00
28,First Micro Finance Laghubitta Bittiya Sanstha Limited,44,1115.00,1098.00,1102.00,5443.00,6027934.00,1120.00,-18.00
29,Forward Microfinance Laghubitta Bittiya Sanstha Limited,182,3936.00,3800.00,3840.00,5340.00,20603338.00,3859.00,-19.00
30,Gandaki Bikas Bank Limited,65,400.00,390.00,396.00,25332.00,9978824.00,400.00,-4.00
31,Garima Bikas Bank Limited,92,280.00,270.00,273.00,22063.00,6020540.00,276.00,-3.00
32,Global IME Bank Limited,112,389.00,386.00,387.00,23358.00,9041792.00,388.00,-1.00
33,Global IME Laghubitta Bittiya Sanstha Ltd.,6,2162.00,2120.00,2162.00,221.00,470840.00,2160.00,2.00
34,Global IME Samunnat Scheme-1,9,10.05,9.91,9.95,65418.00,654367.38,10.05,-0.10
35,Goodwill Finance Limited,6,202.00,199.00,202.00,2235.00,445380.00,196.00,6.00
36,Grameen Bikas Laghubitta Bittiya Sanstha Ltd.,93,820.00,761.00,790.00,20018.00,15691908.00,836.00,-46.00
37,Green Development Bank Ltd.,33,600.00,576.00,594.00,353.00,206562.00,581.00,13.00
38,Guheshowori Merchant Bank & Finance Co. Ltd.,1,265.00,265.00,265.00,68.00,18020.00,269.00,-4.00
39,Gurans Life Insurance Company Ltd.,15,1180.00,1165.00,1166.00,1301.00,1521981.00,1180.00,-14.00
40,Guras Life Insurance Company Ltd. Promoter Share,1,0.00,0.00,0.00,45597.00,13679100.00,517.00,0.00
41,Gurkhas Finance Ltd.,2,201.00,201.00,201.00,150.00,30150.00,204.00,-3.00
42,Hamro Bikas Bank Ltd.,9,237.00,233.00,235.00,2445.00,570725.00,237.00,-2.00
43,Hathway Finance Company Limited,8,183.00,177.00,177.00,3620.00,657760.00,183.00,-6.00
44,Himalayan Bank Limited,32,925.00,912.00,925.00,3894.00,3566067.00,915.00,10.00
45,Himalayan Distillery Limited,5,1637.00,1512.00,1512.00,100.00,155790.00,1670.00,-158.00
46,Himalayan General Insurance Co. Ltd,30,819.00,808.00,813.00,2731.00,2218356.00,810.00,3.00
47,Hydorelectricity Investment and Development Company Ltd,171,190.00,183.00,185.00,20201.00,3756897.00,188.00,-3.00
48,IME General Insurance Ltd.,25,1315.00,1290.00,1294.00,2235.00,2911830.00,1290.00,4.00
49,Janaki Finance Company Limited,1,281.00,281.00,281.00,50.00,14050.00,278.00,3.00
50,Janata Bank Nepal Ltd.,97,275.00,272.00,275.00,25390.00,6934778.00,276.00,-1.00
51,Janautthan Samudayic Laghubitta Bittya Sanstha Limited,25,3700.00,3615.00,3690.00,410.00,1501204.00,3670.00,20.00
52,Jebils Finance Ltd.,2,246.00,246.00,246.00,144.00,35424.00,251.00,-5.00
53,Jyoti Bikas Bank Limited,43,202.00,198.00,198.00,7154.00,1427012.00,201.00,-3.00
54,Kabeli Bikas Bank Limited,3,437.00,421.00,421.00,88.00,37600.00,445.00,-24.00
55,Kailash Bikas Bank Ltd.,39,316.00,313.00,313.00,8621.00,2707477.00,316.00,-3.00
56,Kalika Laghubitta Bittiya Sanstha Ltd,28,2299.00,2240.00,2299.00,2481.00,5632434.00,2268.00,31.00
57,Kanchan Development Bank Limited,1,267.00,267.00,267.00,190.00,50730.00,262.00,5.00
58,Kankai Bikas Bank Ltd.,5,220.00,218.00,219.00,413.00,90534.00,224.00,-5.00
59,Karnali Development Bank Limited,7,302.00,297.00,300.00,514.00,153946.00,303.00,-3.00
60,Khanikhola Hydropower Co. Ltd.,56,192.00,186.00,186.00,2774.00,527894.00,192.00,-6.00
61,Kisan Lagubitta Bittiya Sanstha Limited,9,3100.00,3050.00,3078.00,172.00,529518.00,3069.00,9.00
62,Kumari Bank Limited,62,315.00,311.00,312.00,16743.00,5233586.00,317.00,-5.00
63,Lalitpur Finance Ltd.,15,180.00,171.00,174.00,4211.00,731474.00,182.00,-8.00
64,Laxmi Bank Limited,94,339.00,330.00,335.00,22400.00,7464852.00,333.00,2.00
65,Laxmi Laghubitta Bittiya Sanstha Ltd.,18,2025.00,2000.00,2025.00,1031.00,2074930.00,2000.00,25.00
66,Laxmi Value Fund-1,6,11.33,11.25,11.33,71221.00,805593.93,11.07,0.26
67,Life Insurance Corporation (Nepal) Limited,33,2330.00,2300.00,2324.00,4140.00,9595706.00,2345.00,-21.00
68,Lumbini Bikas Bank Ltd.,45,223.00,213.00,222.00,12938.00,2823607.00,215.00,7.00
69,Lumbini General Insurance Co. Ltd.,47,1010.00,1001.00,1001.00,3604.00,3625778.00,1010.00,-9.00
70,Machhapuchhre Bank Limited,76,342.00,335.00,340.00,17382.00,5885937.00,342.00,-2.00
71,Mahalaxmi Bikas Bank Ltd.,84,258.00,250.00,255.00,18577.00,4676837.00,253.00,2.00
72,Mahila Sahayatra Microfinance Bittiya Sanstha Ltd.,52,1180.00,1140.00,1140.00,1702.00,1965502.00,1170.00,-30.00
73,Manjushree Finance Ltd.,8,157.00,155.00,155.00,3005.00,468960.00,159.00,-4.00
74,Mero Microfinance Bittiya Sanstha Ltd.,49,2402.00,2361.00,2380.00,1310.00,3109869.00,2411.00,-31.00
75,Mirmire Microfinance Development Bank Ltd.,20,3230.00,3200.00,3200.00,1095.00,3517205.00,3230.00,-30.00
76,Mission Development Bank Ltd.,1,297.00,297.00,297.00,90.00,26730.00,303.00,-6.00
77,Miteri Development Bank Limited,20,555.00,548.00,548.00,7988.00,4395874.00,559.00,-11.00
78,Mithila LaghuBitta Bittiya Sanstha Limited,6,1330.00,1312.00,1330.00,164.00,216166.00,1350.00,-20.00
79,Muktinath Bikas Bank Ltd.,67,663.00,652.00,655.00,7551.00,4967309.00,659.00,-4.00
80,Nabil Balance Fund 1,200,24.75,23.31,23.71,1390652.00,33080360.97,22.85,0.86
81,Nabil Bank Limited,94,1751.00,1710.00,1737.00,10056.00,17274511.00,1718.00,19.00
82,NABIL Bank Limited Promotor Share,44,1255.00,1245.00,1250.00,6361.00,7942442.00,1242.00,8.00
83,Nabil Equity Fund,44,10.23,10.00,10.16,87982.00,890039.49,10.00,0.16
84,NagBeli LaghuBitta Bikas Bank Ltd.,15,3480.00,3455.00,3455.00,509.00,1762695.00,3455.00,0.00
85,National Hydro Power Company Limited,59,158.00,152.00,153.00,60505.00,9337360.00,158.00,-5.00
86,National Life Insurance Co. Ltd.,29,2079.00,2000.00,2016.00,3296.00,6647830.00,2060.00,-44.00
87,National Life Insurance Co. Ltd. Promoter Share,3,1225.00,1195.00,1195.00,28000.00,33460360.00,1250.00,-55.00
88,National Microfinance Laghubitta Bittiya Sanstha Limited,80,3651.00,3600.00,3643.00,1551.00,5638969.00,3660.00,-17.00
89,Naya Sarathi Laghubitta Bittiya Sanstha Limited,16,2750.00,2676.00,2700.00,810.00,2192200.00,2785.00,-85.00
90,Neco Insurance Limited,84,1125.00,1105.00,1122.00,11112.00,12417867.00,1126.00,-4.00
91,Nepal Bangladesh Bank Limited,199,371.00,360.00,362.00,37372.00,13535687.00,365.00,-3.00
92,Nepal Bank Limited,80,364.00,355.00,355.00,44856.00,16129996.00,365.00,-10.00
93,Nepal Community Development Bank Ltd.,6,326.00,320.00,324.00,379.00,122248.00,323.00,1.00
94,Nepal Credit & Commercial Bank Ltd. Promoter Share,1,202.00,202.00,202.00,6406.00,1294012.00,202.00,0.00
95,Nepal Credit And Commercial Bank Limited,61,368.00,364.00,366.00,15442.00,5640258.00,366.00,0.00
96,Nepal Doorsanchar Company Limited,17,700.00,695.00,699.00,6640.00,4633390.00,702.00,-3.00
97,Nepal Insurance Co. Ltd.,24,1596.00,1560.00,1596.00,3704.00,5807475.00,1578.00,18.00
98,Nepal Investment Bank Limited,170,774.00,765.00,770.00,20257.00,15545374.00,770.00,0.00
99,Nepal Investment Bank Ltd. Promoter Share,10,684.00,678.00,680.00,2040.00,1386262.00,671.00,9.00
100,Nepal Life Insurance Co. Ltd.,380,2165.00,2141.00,2150.00,22632.00,48639865.00,2159.00,-9.00
101,Nepal SBI Bank Limited,35,918.00,910.00,915.00,5595.00,5103242.00,914.00,1.00
102,Nerude Laghubitta Bittiya Sanstha Limited,6,1440.00,1430.00,1436.00,450.00,645060.00,1440.00,-4.00
103,Ngadi Group Power Ltd.,19,267.00,262.00,266.00,398.00,105906.00,267.00,-1.00
104,NIBL Pragati Fund,4,10.20,10.00,10.20,5808.00,58231.60,10.00,0.20
105,NIBL Samriddhi Fund 1,14,13.40,13.20,13.25,71282.00,944077.81,13.35,-0.10
106,NIC Asia Bank Ltd.,115,470.00,460.00,462.00,20057.00,9285011.00,462.00,0.00
107,Nirdhan Utthan Laghubitta Bittiya Sanstha Limited,13,2185.00,2156.00,2184.00,598.00,1300763.00,2193.00,-9.00
108,NLG Insurance Company Ltd.,18,1605.00,1580.00,1585.00,811.00,1287502.00,1581.00,4.00
109,NMB  Microfinance Bittiya Sanstha Ltd.,37,2820.00,2800.00,2805.00,1421.00,3999869.00,2875.00,-70.00
110,NMB Bank Limited,49,534.00,529.00,531.00,6015.00,3200925.00,531.00,0.00
111,NMB Hybrid Fund L-1,15,10.15,10.09,10.10,38031.00,384171.34,10.05,0.05
112,NMB Sulav Investment Fund-1,6,14.60,14.45,14.60,53000.00,770620.00,14.20,0.40
113,Om Development Bank Ltd.,55,430.00,415.00,419.00,14386.00,6024979.00,420.00,-1.00
114,Oriental Hotels Limited,16,939.00,901.00,908.00,3314.00,3031767.00,924.00,-16.00
115,Pokhara Finance Ltd.,20,260.00,248.00,259.00,3369.00,848084.00,250.00,9.00
116,Prabhu  Bank Limited,94,400.00,392.00,395.00,18959.00,7485620.00,395.00,0.00
117,Prabhu  Bank Limited Promoter Share,1,190.00,190.00,190.00,27530.00,5230700.00,190.00,0.00
118,Prabhu Insurance Ltd.,52,1200.00,1191.00,1200.00,6144.00,7338322.00,1208.00,-8.00
119,Premier Insurance Company (Nepal) Limited,17,1780.00,1750.00,1780.00,3699.00,6511220.00,1780.00,0.00
120,Prime Commercial Bank Ltd.,134,454.00,446.00,454.00,20287.00,9145720.00,451.00,3.00
121,Prime Life Insurance Company Limited,43,2710.00,2650.00,2682.00,5853.00,15657596.00,2699.00,-17.00
122,Progressive Finance Limited,9,243.00,227.00,243.00,2130.00,503040.00,240.00,3.00
123,Prudential Insurance Co. Ltd.,19,1564.00,1547.00,1559.00,2561.00,3981193.00,1564.00,-5.00
124,Purnima Bikas Bank Ltd.,4,321.00,314.00,314.00,112.00,35852.00,315.00,-1.00
125,Rastriya Beema Company Limited,11,17750.00,17310.00,17750.00,186.00,3257650.00,17600.00,150.00
126,Rastriya Beema Company Limited Promoter Share,28,16050.00,15417.00,15650.00,761.00,12043500.00,15800.00,-150.00
127,Reliance Finance Ltd.,8,218.00,214.00,218.00,665.00,143222.00,218.00,0.00
128,Ridi Hydropower Development Company Ltd.,40,185.00,180.00,184.00,2766.00,503745.00,185.00,-1.00
129,RMDC Laghubitta Bittiya Sanstha Ltd.,28,825.00,807.00,820.00,2163.00,1775884.00,821.00,-1.00
130,RSDC Laghubitta Bittiya Sanstha Ltd.,55,3040.00,3000.00,3020.00,902.00,2723173.00,3012.00,8.00
131,Sagarmatha Insurance Co. Ltd.,19,1760.00,1750.00,1760.00,1134.00,1988940.00,1770.00,-10.00
132,Sahayogi Bikas Bank Limited,2,363.00,356.00,356.00,250.00,90400.00,370.00,-14.00
133,Samriddhi Finance Company Limited,19,169.00,155.00,164.00,3520.00,549190.00,172.00,-8.00
134,Sana Kisan Bikas Laghubitta Bittiya Sanstha Limited,24,1639.00,1630.00,1639.00,2906.00,4757370.00,1648.00,-9.00
135,Sanima Bank Limited,129,420.00,413.00,414.00,23979.00,10003389.00,418.00,-4.00
136,Sanima Mai Hydropower Ltd.,70,576.00,545.00,576.00,17110.00,9567952.00,544.00,32.00
137,Saptakoshi Development Bank Ltd.,14,190.00,186.00,187.00,1667.00,313718.00,187.00,0.00
138,Shangrila Development Bank Ltd.,26,405.00,400.00,400.00,3829.00,1533040.00,403.00,-3.00
139,Shikhar Insurance Co. Ltd.,74,2115.00,2090.00,2100.00,9276.00,19465330.00,2105.00,-5.00
140,Shine Resunga Development Bank Ltd.,28,422.00,415.00,415.00,12631.00,5247137.00,420.00,-5.00
141,Shree Investment Finance Co. Ltd.,11,473.00,463.00,473.00,3702.00,1719750.00,471.00,2.00
142,Shrijana Finance  (Bittaya Sanstha),24,496.00,460.00,496.00,4600.00,2259970.00,451.00,45.00
143,Siddhartha Bank Limited,65,450.00,445.00,447.00,10351.00,4631876.00,450.00,-3.00
144,Siddhartha Equity Orineted Scheme,15,13.49,13.28,13.49,61242.00,819071.00,13.20,0.29
145,Siddhartha Insurance Ltd.,36,1610.00,1590.00,1600.00,2741.00,4385490.00,1612.00,-12.00
146,Siddhartha Investment Growth Scheme-1,28,27.00,26.40,27.00,269000.00,7140575.00,26.54,0.46
147,Sindhu Bikash Bank Ltd,26,362.00,346.00,347.00,1871.00,656455.00,355.00,-8.00
148,Soaltee Hotel Limited,13,376.00,372.00,376.00,5460.00,2043200.00,375.00,1.00
149,Standard Chartered Bank Limited,219,2290.00,2280.00,2286.00,8619.00,19683959.00,2285.00,1.00
150,Summit Laghubitta Bittiya Sanstha Limited,33,3670.00,3642.00,3655.00,1569.00,5733905.00,3641.00,14.00
151,Sunrise Bank Limited,50,370.00,364.00,367.00,6494.00,2375991.00,368.00,-1.00
152,Surya Life Insurance Company Limited,32,1165.00,1150.00,1156.00,3438.00,3981225.00,1165.00,-9.00
153,Suryodaya Womi Laghubitta Bittiya Sanstha Limited,27,1944.00,1900.00,1900.00,1412.00,2710632.00,1950.00,-50.00
154,Swabalamban Laghubitta Bittiya Sanstha Limited,20,1841.00,1800.00,1800.00,2206.00,3979985.00,1805.00,-5.00
155,Swadeshi Laghubitta Bittiya Sanstha Ltd.,2,338.00,332.00,338.00,22.00,7376.00,326.00,12.00
156,Swarojgar Laghu Bitta Bikas Bank Ltd.,13,1925.00,1841.00,1915.00,3580.00,6676590.00,1916.00,-1.00
157,Synergy Finance Ltd.,5,155.00,152.00,152.00,510.00,78150.00,155.00,-3.00
158,Synergy Power Development Ltd.,45,200.00,193.00,193.00,3813.00,740843.00,203.00,-10.00
159,Taragaon Regency Hotel Limited,9,290.00,285.00,290.00,880.00,254730.00,295.00,-5.00
160,Tinau Development Bank Limited,13,331.00,313.00,313.00,2119.00,667595.00,325.00,-12.00
161,Unilever Nepal Limited,1,29950.00,29950.00,29950.00,30.00,898500.00,30001.00,-51.00
162,United Finance Ltd.,6,266.00,261.00,265.00,1056.00,279021.00,266.00,-1.00
163,United Insurance Co. (Nepal) Ltd.,11,1560.00,1552.00,1556.00,680.00,1058898.00,1567.00,-11.00
164,United Insurance Co. (Nepal) Ltd. Promoter Share,12,0.00,0.00,0.00,4331.00,6791008.00,0.00,0.00
165,United Modi Hydropower Ltd.,42,307.00,300.00,307.00,1299.00,395102.00,309.00,-2.00
166,Vijaya laghubitta Bittiya Sanstha Ltd.,21,1400.00,1342.00,1400.00,518.00,715197.00,1365.00,35.00
