S.N.,Traded Companies,No. Of Transaction,Max Price,Min Price,Closing Price,Traded Shares,Amount,Previous Closing,Difference Rs.
1,Agricultural Development Bank Limited,49,433.00,427.00,433.00,5553.00,2393186.00,429.00,4.00
2,Api Power Company Ltd.,22,550.00,542.00,546.00,466.00,254634.00,548.00,-2.00
3,Arun Kabeli Power Ltd.,13,325.00,315.00,325.00,1226.00,397115.00,320.00,5.00
4,Arun Valley Hydropower Development Co. Ltd.,9,212.00,206.00,210.00,1985.00,414990.00,210.00,0.00
5,Asian Life Insurance Co. Limited,12,1475.00,1450.00,1475.00,452.00,660140.00,1470.00,5.00
6,Bank of Kathmandu Ltd.,30,434.00,425.00,432.00,6175.00,2639993.00,424.00,8.00
7,Barun Hydropower Co. Ltd.,2,199.00,199.00,199.00,20.00,3980.00,203.00,-4.00
8,Best Finance Company Ltd.,18,139.00,129.00,139.00,2700.00,372240.00,127.00,12.00
9,Bhargav Bikash Bank Ltd.,4,260.00,255.00,260.00,713.00,181980.00,260.00,0.00
10,Bishal Bazar Company Limited,9,2145.00,2111.00,2144.00,380.00,808110.00,2103.00,41.00
11,Butwal Power Company Limited,3,615.00,600.00,615.00,1425.00,856035.00,610.00,5.00
12,Central Finance Co. Ltd.,4,181.00,178.00,181.00,1155.00,207405.00,181.00,0.00
13,Century Commercial Bank Ltd.,59,224.00,218.00,223.00,14671.00,3230153.00,220.00,3.00
14,Chhimek Laghubitta Bittiya Sanstha Limited,36,1405.00,1390.00,1390.00,4390.00,6148593.00,1390.00,0.00
15,Chhyangdi Hydropower Ltd.,11,176.00,171.00,176.00,352.00,61108.00,173.00,3.00
16,Chilime Hydropower Company Limited,101,851.00,829.00,842.00,10182.00,8600839.00,838.00,4.00
17,Citizen Investment Trust,18,3700.00,3679.00,3700.00,34555.00,106637450.00,3679.00,21.00
18,Citizens Bank International Limited,67,297.00,289.00,289.00,12491.00,3652687.00,293.00,-4.00
19,City Express Finance Co. Limited,2,170.00,170.00,170.00,400.00,68000.00,171.00,-1.00
20,Civil Bank Ltd,35,230.00,223.00,230.00,4561.00,1026629.00,225.00,5.00
21,Civil Laghubitta Bittiya Sanstha Ltd.,6,1220.00,1175.00,1181.00,140.00,167550.00,1196.00,-15.00
22,Deprosc Laghubitta Bittiya Sanstha Limited,144,1200.00,1194.00,1195.00,132462.00,159651445.00,1194.00,1.00
23,Deva Bikas Bank Limited,10,255.00,245.00,255.00,3240.00,801685.00,250.00,5.00
24,Dibyashwori Hydropower Ltd.,2,158.00,155.00,155.00,22.00,3443.00,155.00,0.00
25,Everest Bank Limited,29,1210.00,1195.00,1210.00,2976.00,3588981.00,1210.00,0.00
26,Everest Insurance Co. Ltd.,4,2655.00,2640.00,2650.00,153.00,405220.00,2590.00,60.00
27,Excel Development Bank Ltd.,9,468.00,455.00,465.00,2140.00,986355.00,452.00,13.00
28,First Micro Finance Laghubitta Bittiya Sanstha Limited,14,831.00,804.00,820.00,1314.00,1077008.00,818.00,2.00
29,Forward Microfinance Laghubitta Bittiya Sanstha Limited,19,3550.00,3505.00,3549.00,666.00,2352110.00,3535.00,14.00
30,Gandaki Bikas Bank Limited,54,355.00,345.00,348.00,14855.00,5179144.00,352.00,-4.00
31,Garima Bikas Bank Limited,18,255.00,248.00,253.00,2539.00,638465.00,249.00,4.00
32,Global IME Bank Limited,56,380.00,368.00,379.00,15071.00,5655321.00,375.00,4.00
33,Global IME Laghubitta Bittiya Sanstha Ltd.,2,1925.00,1920.00,1925.00,21.00,40375.00,1940.00,-15.00
34,Grameen Bikas Laghubitta Bittiya Sanstha Ltd.,24,675.00,661.00,670.00,9782.00,6523864.00,666.00,4.00
35,Green Development Bank Ltd.,5,550.00,530.00,550.00,90.00,48590.00,530.00,20.00
36,Guheshowori Merchant Bank & Finance Co. Ltd.,8,210.00,195.00,195.00,1570.00,314990.00,206.00,-11.00
37,Gurans Life Insurance Company Ltd.,21,1020.00,1000.00,1000.00,1925.00,1948262.00,1000.00,0.00
38,Gurkhas Finance Ltd.,4,186.00,183.00,186.00,6095.00,1115670.00,181.00,5.00
39,Hamro Bikas Bank Ltd.,1,194.00,194.00,194.00,20.00,3880.00,191.00,3.00
40,Hathway Finance Company Limited,8,156.00,153.00,153.00,1340.00,205560.00,159.00,-6.00
41,Himalayan Bank Limited,8,865.00,852.00,865.00,921.00,790343.00,855.00,10.00
42,Himalayan General Insurance Co. Ltd,8,716.00,708.00,715.00,741.00,529195.00,702.00,13.00
43,Himalayan Power Partner Ltd.,76,380.00,366.00,370.00,1058.00,390244.00,375.00,-5.00
44,Hydorelectricity Investment and Development Company Ltd,39,181.00,176.00,181.00,5282.00,946769.00,178.00,3.00
45,ICFC Finance Limited,1,230.00,230.00,230.00,300.00,69000.00,230.00,0.00
46,IME General Insurance Ltd.,40,1130.00,1100.00,1100.00,4171.00,4629974.00,1150.00,-50.00
47,Janaki Finance Company Limited,5,274.00,270.00,270.00,606.00,163824.00,275.00,-5.00
48,Janata Bank Nepal Ltd.,77,257.00,250.00,255.00,25735.00,6541851.00,253.00,2.00
49,Janautthan Samudayic Laghubitta Bittya Sanstha Limited,14,3650.00,3602.00,3620.00,128.00,464256.00,3627.00,-7.00
50,Jebils Finance Ltd.,1,136.00,136.00,136.00,150.00,20400.00,138.00,-2.00
51,Jyoti Bikas Bank Limited,13,182.00,181.00,181.00,2278.00,413580.00,183.00,-2.00
52,Kailash Bikas Bank Ltd.,12,290.00,286.00,290.00,1938.00,559231.00,286.00,4.00
53,Kalika Laghubitta Bittiya Sanstha Ltd,13,1904.00,1870.00,1904.00,560.00,1053700.00,1867.00,37.00
54,Kamana Sewa Bikas Bank Limited,44,213.00,207.00,208.00,4111.00,856961.00,209.00,-1.00
55,Karnali Development Bank Limited,5,251.00,250.00,251.00,168.00,42061.00,255.00,-4.00
56,Khanikhola Hydropower Co. Ltd.,5,158.00,155.00,156.00,74.00,11566.00,156.00,0.00
57,Kisan Lagubitta Bittiya Sanstha Limited,7,2500.00,2440.00,2500.00,292.00,721256.00,2430.00,70.00
58,Kumari Bank Limited,89,300.00,291.00,295.00,49483.00,14531071.00,290.00,5.00
59,Laxmi Bank Limited,24,317.00,314.00,314.00,2106.00,664374.00,313.00,1.00
60,Laxmi Equity Fund,1,10.10,10.10,10.10,1000.00,10100.00,10.10,0.00
61,Laxmi Laghubitta Bittiya Sanstha Ltd.,4,1591.00,1560.00,1591.00,182.00,289102.00,1560.00,31.00
62,Laxmi Value Fund-1,2,11.35,11.30,11.35,8000.00,90550.00,11.33,0.02
63,Life Insurance Corporation (Nepal) Limited,4,2070.00,2050.00,2070.00,990.00,2048160.00,2041.00,29.00
64,Lumbini Bikas Bank Ltd.,18,212.00,207.00,212.00,4951.00,1036463.00,208.00,4.00
65,Lumbini General Insurance Co. Ltd.,89,887.00,845.00,850.00,8550.00,7309340.00,870.00,-20.00
66,Machhapuchhre Bank Limited,34,317.00,310.00,313.00,13352.00,4192358.00,315.00,-2.00
67,Mahalaxmi Bikas Bank Ltd.,17,225.00,217.00,220.00,10365.00,2282230.00,217.00,3.00
68,Mahila Sahayatra Microfinance Bittiya Sanstha Ltd.,3,1020.00,1015.00,1020.00,121.00,122870.00,1035.00,-15.00
69,Manjushree Finance Ltd.,20,150.00,145.00,145.00,5513.00,803646.00,144.00,1.00
70,Mero Microfinance Bittiya Sanstha Ltd.,14,1560.00,1540.00,1560.00,219.00,339726.00,1560.00,0.00
71,Mirmire Microfinance Development Bank Ltd.,2,2920.00,2880.00,2920.00,60.00,173200.00,2825.00,95.00
72,Miteri Development Bank Limited,1,528.00,528.00,528.00,70.00,36960.00,526.00,2.00
73,Mithila LaghuBitta Bittiya Sanstha Limited,1,1202.00,1202.00,1202.00,22.00,26444.00,1202.00,0.00
74,Muktinath Bikas Bank Ltd.,19,595.00,587.00,592.00,2610.00,1541980.00,587.00,5.00
75,Nabil Balance Fund 1,1,17.85,17.85,17.85,2570.00,45874.50,17.50,0.35
76,Nabil Bank Limited,26,1219.00,1200.00,1219.00,1432.00,1731988.00,1200.00,19.00
77,NABIL Bank Limited Promotor Share,9,877.00,855.00,875.00,3400.00,2932760.00,866.00,9.00
78,Nabil Equity Fund,9,10.30,10.20,10.30,23494.00,240941.37,10.30,0.00
79,NagBeli LaghuBitta Bikas Bank Ltd.,16,3790.00,3725.00,3755.00,566.00,2128927.00,3720.00,35.00
80,National Hydro Power Company Limited,7,129.00,127.00,129.00,3210.00,408190.00,127.00,2.00
81,National Life Insurance Co. Ltd.,6,1800.00,1775.00,1791.00,380.00,679430.00,1800.00,-9.00
82,National Microfinance Laghubitta Bittiya Sanstha Limited,24,3250.00,3185.00,3200.00,339.00,1092800.00,3200.00,0.00
83,Naya Sarathi Laghubitta Bittiya Sanstha Limited,8,2774.00,2671.00,2774.00,582.00,1580060.00,2619.00,155.00
84,Neco Insurance Limited,13,905.00,895.00,895.00,993.00,894495.00,896.00,-1.00
85,Nepal Bangladesh Bank Limited,40,321.00,318.00,320.00,5566.00,1776011.00,320.00,0.00
86,Nepal Bank Limited,33,350.00,340.00,349.00,11190.00,3889041.00,341.00,8.00
87,Nepal Community Development Bank Ltd.,4,186.00,178.00,186.00,78.00,14282.00,181.00,5.00
88,Nepal Credit And Commercial Bank Limited,51,352.00,349.00,352.00,17775.00,6221689.00,354.00,-2.00
89,Nepal Doorsanchar Company Limited,47,785.00,775.00,780.00,13400.00,10470625.00,780.00,0.00
90,Nepal Insurance Co. Ltd.,8,1432.00,1383.00,1400.00,610.00,854230.00,1404.00,-4.00
91,Nepal Investment Bank Limited,60,628.00,620.00,623.00,4621.00,2878343.00,625.00,-2.00
92,Nepal Investment Bank Ltd. Promoter Share,4,561.00,555.00,555.00,1560.00,867660.00,555.00,0.00
93,Nepal Life Insurance Co. Ltd.,152,1983.00,1964.00,1968.00,4556.00,8985583.00,1988.00,-20.00
94,Nepal SBI Bank Limited,39,809.00,800.00,800.00,4322.00,3459523.00,801.00,-1.00
95,Nerude Laghubitta Bittiya Sanstha Limited,12,1180.00,1115.00,1178.00,604.00,701869.00,1137.00,41.00
96,Ngadi Group Power Ltd.,6,230.00,227.00,230.00,215.00,49297.00,229.00,1.00
97,NIBL Pragati Fund,2,10.20,10.10,10.20,1516.00,15387.40,10.15,0.05
98,NIBL Samriddhi Fund 1,1,11.65,11.65,11.65,6000.00,69900.00,11.50,0.15
99,NIC Asia Bank Ltd.,37,355.00,349.00,355.00,6036.00,2126063.00,354.00,1.00
100,Nirdhan Utthan Laghubitta Bittiya Sanstha Limited,28,2365.00,2345.00,2352.00,1519.00,3573192.00,2345.00,7.00
101,NLG Insurance Company Ltd.,4,1485.00,1474.00,1485.00,103.00,152701.00,1447.00,38.00
102,NMB  Microfinance Bittiya Sanstha Ltd.,5,2652.00,2630.00,2652.00,107.00,282420.00,2630.00,22.00
103,NMB Bank Limited,21,479.00,465.00,476.00,14124.00,6718129.00,470.00,6.00
104,NMB Hybrid Fund L-1,3,10.02,10.02,10.02,5824.00,58356.48,10.02,0.00
105,NMB Sulav Investment Fund-1,1,12.48,12.48,12.48,5000.00,62400.00,12.24,0.24
106,Om Development Bank Ltd.,12,290.00,287.00,290.00,1185.00,342121.00,289.00,1.00
107,Om Development Bank Ltd. Promoter,1,240.00,240.00,240.00,45329.00,10878960.00,239.00,1.00
108,Oriental Hotels Limited,5,868.00,850.00,868.00,173.00,147745.00,853.00,15.00
109,Pokhara Finance Ltd.,9,225.00,224.00,225.00,273.00,61315.00,226.00,-1.00
110,Prabhu  Bank Limited,52,367.00,360.00,365.00,7970.00,2900166.00,363.00,2.00
111,Prabhu Insurance Ltd.,16,1107.00,1100.00,1102.00,2510.00,2769020.00,1111.00,-9.00
112,Premier Insurance Company (Nepal) Limited,7,1583.00,1552.00,1583.00,728.00,1139556.00,1552.00,31.00
113,Prime Commercial Bank Ltd.,85,438.00,425.00,435.00,16880.00,7253332.00,430.00,5.00
114,Prime Commercial Bank Promoter Share,2,260.00,255.00,255.00,2000.00,515000.00,265.00,-10.00
115,Prime Life Insurance Company Limited,11,1850.00,1795.00,1830.00,1065.00,1929050.00,1820.00,10.00
116,Progressive Finance Limited,10,228.00,204.00,228.00,4112.00,885696.00,208.00,20.00
117,Prudential Insurance Co. Ltd.,2,1420.00,1420.00,1420.00,550.00,781000.00,1430.00,-10.00
118,Purnima Bikas Bank Ltd.,10,304.00,299.00,304.00,575.00,173239.00,298.00,6.00
119,Rastriya Beema Company Limited,15,16027.00,15402.00,15600.00,200.00,3153560.00,15100.00,500.00
120,Rastriya Beema Company Limited Promoter Share,16,14700.00,14280.00,14308.00,245.00,3562925.00,14000.00,308.00
121,Reliance Finance Ltd.,13,212.00,201.00,205.00,4665.00,954575.00,210.00,-5.00
122,Ridi Hydropower Development Company Ltd.,16,164.00,160.00,163.00,291.00,47243.00,163.00,0.00
123,RMDC Laghubitta Bittiya Sanstha Ltd.,15,699.00,675.00,699.00,685.00,467170.00,675.00,24.00
124,RSDC Laghubitta Bittiya Sanstha Ltd.,8,1264.00,1250.00,1255.00,194.00,242790.00,1240.00,15.00
125,Sagarmatha Insurance Co. Ltd.,4,1665.00,1638.00,1640.00,256.00,421694.00,1656.00,-16.00
126,Sahayogi Bikas Bank Limited,3,318.00,318.00,318.00,555.00,176490.00,316.00,2.00
127,Sana Kisan Bikas Laghubitta Bittiya Sanstha Limited,4,1550.00,1545.00,1545.00,236.00,365336.00,1530.00,15.00
128,Sanima Bank Limited,87,345.00,336.00,342.00,14109.00,4819803.00,336.00,6.00
129,Sanima Mai Hydropower Ltd.,7,520.00,515.00,517.00,1014.00,525080.00,518.00,-1.00
130,Saptakoshi Development Bank Ltd.,5,181.00,180.00,180.00,342.00,61792.00,181.00,-1.00
131,Shangrila Development Bank Ltd.,7,373.00,369.00,369.00,638.00,236200.00,366.00,3.00
132,Shikhar Insurance Co. Ltd.,9,1935.00,1910.00,1910.00,523.00,1005100.00,1926.00,-16.00
133,Shine Resunga Development Bank Ltd.,4,405.00,400.00,405.00,633.00,255725.00,410.00,-5.00
134,Shree Investment Finance Co. Ltd.,3,443.00,440.00,440.00,1010.00,445930.00,435.00,5.00
135,Shrijana Finance  (Bittaya Sanstha),2,540.00,539.00,539.00,200.00,107900.00,549.00,-10.00
136,Siddhartha Bank Limited,52,404.00,400.00,402.00,9365.00,3756896.00,400.00,2.00
137,Siddhartha Equity Orineted Scheme,14,12.06,11.82,12.06,64393.00,773269.58,11.82,0.24
138,Siddhartha Insurance Ltd.,11,1415.00,1400.00,1410.00,1140.00,1600082.00,1410.00,0.00
139,Siddhartha Investment Growth Scheme-1,1,20.81,20.81,20.81,5000.00,104050.00,20.40,0.41
140,Sindhu Bikash Bank Ltd,6,185.00,177.00,177.00,369.00,66813.00,185.00,-8.00
141,Soaltee Hotel Limited,7,360.00,358.00,360.00,1891.00,679560.00,355.00,5.00
142,Standard Chartered Bank Limited,93,2120.00,2091.00,2116.00,2761.00,5808769.00,2114.00,2.00
143,Summit Laghubitta Bittiya Sanstha Limited,4,2020.00,1950.00,2020.00,296.00,589380.00,1950.00,70.00
144,Sunrise Bank Limited,62,324.00,315.00,324.00,15059.00,4799961.00,316.00,8.00
145,Surya Life Insurance Company Limited,7,949.00,931.00,949.00,322.00,302607.00,941.00,8.00
146,Suryodaya Womi Laghubitta Bittiya Sanstha Limited,25,1940.00,1850.00,1940.00,860.00,1635542.00,1830.00,110.00
147,Swabalamban Laghubitta Bittiya Sanstha Limited,8,1599.00,1594.00,1594.00,496.00,791764.00,1577.00,17.00
148,Swarojgar Laghu Bitta Bikas Bank Ltd.,5,1803.00,1800.00,1802.00,320.00,576400.00,1807.00,-5.00
149,Synergy Power Development Ltd.,21,164.00,162.00,162.00,332.00,53829.00,162.00,0.00
150,Taragaon Regency Hotel Limited,4,280.00,275.00,275.00,2130.00,587440.00,275.00,0.00
151,Tinau Development Bank Limited,9,263.00,260.00,263.00,567.00,147863.00,260.00,3.00
152,United Finance Ltd.,2,256.00,255.00,256.00,389.00,99270.00,258.00,-2.00
153,United Insurance Co. (Nepal) Ltd.,7,1250.00,1241.00,1249.00,600.00,748020.00,1239.00,10.00
154,United Modi Hydropower Ltd.,9,262.00,257.00,262.00,124.00,32292.00,260.00,2.00
155,Vijaya laghubitta Bittiya Sanstha Ltd.,17,1254.00,1230.00,1233.00,675.00,836574.00,1270.00,-37.00
