S.N.,Traded Companies,No. Of Transaction,Max Price,Min Price,Closing Price,Traded Shares,Amount,Previous Closing,Difference Rs.
1,Agricultural Development Bank Limited,74,448.00,433.00,448.00,16129.00,7096066.00,433.00,15.00
2,Api Power Company Ltd.,38,554.00,541.00,554.00,938.00,514452.00,552.00,2.00
3,Arun Kabeli Power Ltd.,151,416.00,407.00,412.00,7175.00,2944449.00,415.00,-3.00
4,Arun Valley Hydropower Development Co. Ltd.,33,284.00,270.00,284.00,8159.00,2238220.00,276.00,8.00
5,Asian Life Insurance Co. Limited,17,1490.00,1468.00,1480.00,1914.00,2844325.00,1460.00,20.00
6,Bank of Kathmandu Ltd.,82,472.00,462.00,470.00,15778.00,7355825.00,462.00,8.00
7,Barun Hydropower Co. Ltd.,21,255.00,250.00,251.00,270.00,67920.00,252.00,-1.00
8,Bhargav Bikash Bank Ltd.,22,305.00,299.00,303.00,3500.00,1061740.00,297.00,6.00
9,Bottlers Nepal (Terai) Limited,1,6205.00,6205.00,6205.00,20.00,124100.00,6085.00,120.00
10,Butwal Power Company Limited,3,632.00,620.00,632.00,108.00,67482.00,620.00,12.00
11,Central Finance Co. Ltd.,15,195.00,189.00,191.00,6537.00,1256183.00,190.00,1.00
12,Century Commercial Bank Ltd.,91,285.00,280.00,285.00,14944.00,4212217.00,282.00,3.00
13,Chhimek Laghubitta Bittiya Sanstha Limited,33,1575.00,1530.00,1567.00,2478.00,3878767.00,1558.00,9.00
14,Chilime Hydropower Company Limited,48,800.00,786.00,793.00,6034.00,4788753.00,795.00,-2.00
15,Citizen Investment Trust,10,4045.00,4000.00,4000.00,380.00,1524800.00,3980.00,20.00
16,Citizens Bank International Limited,62,406.00,394.00,406.00,8903.00,3587129.00,402.00,4.00
17,City Express Finance Co. Limited,22,159.00,139.00,141.00,1940.00,280820.00,150.00,-9.00
18,City Express Finance Co. Ltd. Promoter Share,6,103.00,100.00,100.00,313110.00,31662750.00,105.00,-5.00
19,Civil Bank Ltd,161,260.00,248.00,260.00,59578.00,15142165.00,248.00,12.00
20,Civil Laghubitta Bittiya Sanstha Ltd.,25,1310.00,1260.00,1291.00,822.00,1070638.00,1271.00,20.00
21,Deprosc Laghubitta Bittiya Sanstha Limited,37,1338.00,1300.00,1315.00,4722.00,6238533.00,1295.00,20.00
22,Deva Bikas Bank Limited,48,275.00,264.00,275.00,21741.00,5836089.00,266.00,9.00
23,Dibyashwori Hydropower Ltd.,22,210.00,202.00,205.00,229.00,46896.00,210.00,-5.00
24,Everest Bank Limited,73,1367.00,1360.00,1363.00,6497.00,8865518.00,1368.00,-5.00
25,Everest Bank Limited Con. Pref.,3,921.00,885.00,885.00,140.00,126960.00,923.00,-38.00
26,Everest Insurance Co. Ltd.,55,2495.00,2451.00,2455.00,2016.00,4997902.00,2470.00,-15.00
27,Excel Development Bank Ltd.,16,618.00,610.00,614.00,2528.00,1550542.00,615.00,-1.00
28,First Micro Finance Laghubitta Bittiya Sanstha Limited,38,1040.00,1020.00,1020.00,3605.00,3711040.00,1015.00,5.00
29,Forward Microfinance Laghubitta Bittiya Sanstha Limited,684,3570.00,3260.00,3542.00,14227.00,48903466.00,3298.00,244.00
30,Garima Bikas Bank Limited,41,300.00,295.00,300.00,5536.00,1644991.00,295.00,5.00
31,Global IME Bank Limited,83,398.00,388.00,395.00,41946.00,16377518.00,385.00,10.00
32,Global IME Laghubitta Bittiya Sanstha Ltd.,19,2100.00,1948.00,2090.00,383.00,770887.00,1948.00,142.00
33,Global IME Samunnat Scheme-1,2,10.10,9.90,10.10,10000.00,100800.00,9.90,0.20
34,Goodwill Finance Limited,4,214.00,209.00,209.00,140.00,29430.00,210.00,-1.00
35,Grameen Bikas Laghubitta Bittiya Sanstha Ltd.,4,770.00,742.00,770.00,948.00,720860.00,740.00,30.00
36,Green Development Bank Ltd.,26,628.00,614.00,620.00,338.00,209098.00,622.00,-2.00
37,Guheshowori Merchant Bank & Finance Co. Ltd.,5,274.00,263.00,274.00,422.00,113762.00,267.00,7.00
38,Gurans Life Insurance Company Ltd.,27,1064.00,1022.00,1050.00,3382.00,3545129.00,1025.00,25.00
39,Gurkhas Finance Ltd.,5,185.00,180.00,185.00,366.00,66680.00,182.00,3.00
40,Hamro Bikas Bank Ltd.,1,223.00,223.00,223.00,50.00,11150.00,222.00,1.00
41,Hamro Bikas Bank Ltd. Promoter Share,1,140.00,140.00,140.00,25000.00,3500000.00,140.00,0.00
42,Hathway Finance Company Limited,53,221.00,210.00,219.00,5015.00,1086855.00,214.00,5.00
43,Himalayan Bank Limited,26,910.00,899.00,905.00,2995.00,2702483.00,890.00,15.00
44,Himalayan Distillery Limited,15,891.00,826.00,891.00,550.00,483960.00,810.00,81.00
45,Himalayan General Insurance Co. Ltd,41,740.00,735.00,740.00,5149.00,3800953.00,740.00,0.00
46,Hydorelectricity Investment and Development Company Ltd,103,198.00,195.00,197.00,10345.00,2032738.00,195.00,2.00
47,ICFC Finance Limited,10,292.00,285.00,292.00,4162.00,1193898.00,284.00,8.00
48,IME General Insurance Ltd.,14,1037.00,1000.00,1037.00,1317.00,1337123.00,1000.00,37.00
49,Janaki Finance Company Limited,2,271.00,269.00,271.00,1775.00,477625.00,272.00,-1.00
50,Janata Bank Nepal Ltd.,263,306.00,295.00,306.00,78896.00,23719911.00,294.00,12.00
51,Janautthan Samudayic Laghubitta Bittya Sanstha Limited,8,3115.00,3065.00,3100.00,120.00,371000.00,3065.00,35.00
52,Jyoti Bikas Bank Limited,61,215.00,207.00,213.00,32137.00,6822273.00,208.00,5.00
53,Kabeli Bikas Bank Limited,5,520.00,510.00,510.00,108.00,56060.00,530.00,-20.00
54,Kailash Bikas Bank Ltd.,12,333.00,326.00,333.00,2973.00,976846.00,325.00,8.00
55,Kalika Laghubitta Bittiya Sanstha Ltd,10,1800.00,1745.00,1745.00,616.00,1093300.00,1739.00,6.00
56,Kanchan Development Bank Limited,5,278.00,271.00,278.00,884.00,242782.00,276.00,2.00
57,Karnali Development Bank Limited,8,308.00,304.00,305.00,760.00,232480.00,311.00,-6.00
58,Khanikhola Hydropower Co. Ltd.,49,210.00,198.00,210.00,682.00,138180.00,206.00,4.00
59,Kisan Lagubitta Bittiya Sanstha Limited,28,2870.00,2750.00,2870.00,476.00,1352632.00,2700.00,170.00
60,Kumari Bank Limited,81,336.00,330.00,335.00,28283.00,9418831.00,332.00,3.00
61,Lalitpur Finance Ltd.,1,180.00,180.00,180.00,300.00,54000.00,178.00,2.00
62,Laxmi Bank Limited,22,395.00,383.00,390.00,2827.00,1097199.00,390.00,0.00
63,Laxmi Laghubitta Bittiya Sanstha Ltd.,41,1948.00,1860.00,1925.00,2257.00,4310239.00,1875.00,50.00
64,Laxmi Value Fund-1,14,13.00,12.50,13.00,416000.00,5229825.00,12.25,0.75
65,Life Insurance Corporation (Nepal) Limited,17,2135.00,2110.00,2135.00,1012.00,2148309.00,2149.00,-14.00
66,Lumbini General Insurance Co. Ltd.,19,939.00,926.00,930.00,1846.00,1721220.00,926.00,4.00
67,Machhapuchhre Bank Limited,39,363.00,360.00,363.00,8296.00,2993651.00,357.00,6.00
68,Mahila Sahayatra Microfinance Bittiya Sanstha Ltd.,11,1208.00,1160.00,1180.00,502.00,593654.00,1164.00,16.00
69,Manjushree Finance Ltd.,9,163.00,158.00,163.00,2619.00,418152.00,157.00,6.00
70,Mero Microfinance Bittiya Sanstha Ltd.,57,2250.00,2156.00,2250.00,1941.00,4306438.00,2188.00,62.00
71,Mirmire Microfinance Development Bank Ltd.,12,2283.00,2210.00,2283.00,705.00,1588420.00,2200.00,83.00
72,Mission Development Bank Ltd.,1,311.00,311.00,311.00,50.00,15550.00,317.00,-6.00
73,Miteri Development Bank Limited,5,531.00,515.00,531.00,470.00,247500.00,512.00,19.00
74,Mithila LaghuBitta Bittiya Sanstha Limited,4,1362.00,1336.00,1362.00,374.00,508920.00,1310.00,52.00
75,Muktinath Bikas Bank Ltd.,71,975.00,958.00,971.00,13969.00,13529203.00,957.00,14.00
76,Muktinath Bikas Bank Ltd. Promoter Share,1,472.00,472.00,472.00,28322.00,13367984.00,481.00,-9.00
77,Nabil Balance Fund 1,10,20.10,19.85,20.10,95000.00,1897750.00,19.75,0.35
78,Nabil Bank Limited,100,1599.00,1540.00,1597.00,11170.00,17515322.00,1530.00,67.00
79,NABIL Bank Limited Promotor Share,50,1180.00,1145.00,1180.00,12320.00,14333240.00,1148.00,32.00
80,Nabil Equity Fund,4,10.00,9.99,10.00,15609.00,155977.36,10.00,0.00
81,NagBeli LaghuBitta Bikas Bank Ltd.,12,3240.00,3141.00,3240.00,545.00,1730186.00,3140.00,100.00
82,National Hydro Power Company Limited,37,135.00,130.00,135.00,29800.00,3943160.00,130.00,5.00
83,National Life Insurance Co. Ltd.,49,2375.00,2330.00,2375.00,4700.00,11058931.00,2315.00,60.00
84,National Microfinance Laghubitta Bittiya Sanstha Limited,5,1927.00,1817.00,1927.00,140.00,264240.00,1782.00,145.00
85,Naya Sarathi Laghubitta Bittiya Sanstha Limited,8,2310.00,2265.00,2310.00,455.00,1045479.00,2302.00,8.00
86,Neco Insurance Limited,34,1005.00,990.00,999.00,3887.00,3878120.00,984.00,15.00
87,Nepal Bangladesh Bank Limited,42,414.00,403.00,409.00,8119.00,3305249.00,403.00,6.00
88,Nepal Bank Limited,73,384.00,370.00,379.00,26755.00,10059486.00,368.00,11.00
89,Nepal Community Development Bank Ltd.,5,320.00,313.00,320.00,1184.00,374842.00,307.00,13.00
90,Nepal Credit And Commercial Bank Limited,84,390.00,385.00,385.00,16430.00,6361207.00,383.00,2.00
91,Nepal Doorsanchar Company Limited,11,670.00,660.00,670.00,1430.00,952250.00,670.00,0.00
92,Nepal Insurance Co. Ltd.,54,1510.00,1421.00,1510.00,11476.00,16847110.00,1422.00,88.00
93,Nepal Investment Bank Limited,232,800.00,766.00,780.00,19271.00,15012768.00,775.00,5.00
94,Nepal Investment Bank Ltd. Promoter Share,32,687.00,676.00,685.00,31056.00,21112582.00,676.00,9.00
95,Nepal Life Insurance Co. Ltd.,506,2169.00,2140.00,2168.00,16168.00,34823511.00,2150.00,18.00
96,Nepal SBI Bank Limited,51,941.00,922.00,941.00,5888.00,5457455.00,924.00,17.00
97,Nerude Laghubitta Bittiya Sanstha Limited,27,1319.00,1264.00,1319.00,7828.00,10037810.00,1285.00,34.00
98,Ngadi Group Power Ltd.,19,265.00,260.00,261.00,289.00,75875.00,263.00,-2.00
99,NIBL Samriddhi Fund 1,1,12.25,12.25,12.25,100.00,1225.00,12.01,0.24
100,NIC Asia Bank Ltd.,72,455.00,444.00,455.00,11095.00,5003357.00,442.00,13.00
101,Nirdhan Utthan Laghubitta Bittiya Sanstha Limited,47,2078.00,1975.00,2075.00,3987.00,8133544.00,1995.00,80.00
102,NLG Insurance Company Ltd.,12,1510.00,1480.00,1510.00,870.00,1302466.00,1460.00,50.00
103,NMB  Microfinance Bittiya Sanstha Ltd.,84,2998.00,2905.00,2960.00,2419.00,7110890.00,2905.00,55.00
104,NMB Bank Limited,45,553.00,540.00,551.00,8427.00,4622090.00,545.00,6.00
105,NMB Hybrid Fund L-1,3,10.00,9.90,9.90,1248.00,12438.40,9.94,-0.04
106,NMB Sulav Investment Fund-1,14,13.15,12.61,13.01,139700.00,1817371.00,12.61,0.40
107,Oriental Hotels Limited,4,690.00,675.00,690.00,1291.00,887415.00,670.00,20.00
108,Pokhara Finance Ltd.,5,255.00,246.00,255.00,3125.00,771500.00,251.00,4.00
109,Prabhu  Bank Limited,90,411.00,405.00,410.00,22881.00,9359894.00,406.00,4.00
110,Prabhu Insurance Ltd.,44,1029.00,1012.00,1029.00,4694.00,4789189.00,1014.00,15.00
111,Premier Insurance Company (Nepal) Limited,3,1665.00,1660.00,1665.00,164.00,272310.00,1670.00,-5.00
112,Prime Commercial Bank Ltd.,65,430.00,422.00,427.00,12039.00,5137377.00,422.00,5.00
113,Prime Life Insurance Company Limited,102,2714.00,2666.00,2675.00,10294.00,27710884.00,2699.00,-24.00
114,Progressive Finance Limited,1,196.00,196.00,196.00,500.00,98000.00,197.00,-1.00
115,Prudential Insurance Co. Ltd.,16,1440.00,1420.00,1440.00,1523.00,2174844.00,1425.00,15.00
116,Purnima Bikas Bank Ltd.,11,318.00,308.00,308.00,2139.00,669278.00,306.00,2.00
117,Rastriya Beema Company Limited,14,13290.00,12990.00,12990.00,304.00,3990130.00,13034.00,-44.00
118,Rastriya Beema Company Limited Promoter Share,6,12240.00,12000.00,12000.00,120.00,1448800.00,11806.00,194.00
119,Reliance Finance Ltd.,13,218.00,212.00,212.00,1554.00,332041.00,215.00,-3.00
120,Ridi Hydropower Development Company Ltd.,30,205.00,197.00,203.00,2440.00,486679.00,201.00,2.00
121,RMDC Laghubitta Bittiya Sanstha Ltd.,36,800.00,779.00,800.00,2635.00,2090592.00,774.00,26.00
122,RSDC Laghubitta Bittiya Sanstha Ltd.,108,2980.00,2901.00,2941.00,1115.00,3284541.00,2920.00,21.00
123,Sagarmatha Insurance Co. Ltd.,2,1440.00,1440.00,1440.00,100.00,144000.00,1420.00,20.00
124,Sahayogi Bikas Bank Limited,6,369.00,363.00,363.00,436.00,159628.00,363.00,0.00
125,Samriddhi Finance Company Limited,3,147.00,143.00,147.00,600.00,87000.00,141.00,6.00
126,Sana Kisan Bikas Laghubitta Bittiya Sanstha Limited,20,1555.00,1521.00,1521.00,3692.00,5669444.00,1506.00,15.00
127,Sanima Bank Limited,217,438.00,429.00,436.00,71820.00,30993112.00,429.00,7.00
128,Sanima Mai Hydropower Ltd.,69,1150.00,1135.00,1145.00,11776.00,13466406.00,1150.00,-5.00
129,Saptakoshi Development Bank Ltd.,8,202.00,200.00,201.00,622.00,124662.00,200.00,1.00
130,Shangrila Development Bank Ltd.,21,404.00,395.00,404.00,4780.00,1900148.00,390.00,14.00
131,Shikhar Insurance Co. Ltd.,26,1990.00,1910.00,1990.00,1483.00,2931731.00,1920.00,70.00
132,Shine Resunga Development Bank Ltd.,5,428.00,416.00,428.00,319.00,133580.00,423.00,5.00
133,Shree Investment Finance Co. Ltd.,3,391.00,389.00,391.00,153.00,59803.00,382.00,9.00
134,Shrijana Finance  (Bittaya Sanstha),2,445.00,440.00,445.00,1000.00,442500.00,435.00,10.00
135,Siddhartha Bank Limited,81,489.00,484.00,489.00,19749.00,9582836.00,488.00,1.00
136,Siddhartha Equity Orineted Scheme,7,12.15,12.00,12.15,25800.00,311346.00,12.00,0.15
137,Siddhartha Insurance Ltd.,16,1509.00,1495.00,1501.00,2422.00,3638077.00,1494.00,7.00
138,Soaltee Hotel Limited,25,363.00,360.00,360.00,7064.00,2544860.00,358.00,2.00
139,Standard Chartered Bank Limited,224,2309.00,2296.00,2306.00,7422.00,17081039.00,2298.00,8.00
140,Summit Laghubitta Bittiya Sanstha Limited,7,3050.00,2980.00,3045.00,430.00,1300130.00,3030.00,15.00
141,Sunrise Bank Limited,22,396.00,385.00,393.00,3274.00,1286154.00,391.00,2.00
142,Surya Life Insurance Company Limited,41,1150.00,1080.00,1135.00,4959.00,5590580.00,1081.00,54.00
143,Suryodaya Womi Laghubitta Bittiya Sanstha Limited,14,1979.00,1956.00,1968.00,1114.00,2190063.00,1942.00,26.00
144,Swabalamban Laghubitta Bittiya Sanstha Limited,9,1866.00,1810.00,1850.00,639.00,1171453.00,1800.00,50.00
145,Swarojgar Laghu Bitta Bikas Bank Ltd.,12,1765.00,1720.00,1730.00,1331.00,2331430.00,1700.00,30.00
146,Synergy Finance Ltd.,3,160.00,159.00,160.00,599.00,95641.00,158.00,2.00
147,Synergy Power Development Ltd.,164,257.00,238.00,257.00,3747.00,904611.00,241.00,16.00
148,Taragaon Regency Hotel Limited,7,267.00,257.00,267.00,1680.00,445430.00,257.00,10.00
149,Tinau Development Bank Limited,13,340.00,330.00,340.00,1891.00,639069.00,330.00,10.00
150,Unilever Nepal Limited,3,29201.00,29200.00,29200.00,35.00,1022015.00,29200.00,0.00
151,United Finance Ltd.,2,251.00,248.00,248.00,1000.00,249500.00,247.00,1.00
152,United Insurance Co. (Nepal) Ltd.,17,1470.00,1435.00,1470.00,1891.00,2737312.00,1435.00,35.00
153,United Modi Hydropower Ltd.,62,345.00,333.00,340.00,1888.00,641270.00,336.00,4.00
154,Vijaya laghubitta Bittiya Sanstha Ltd.,26,1417.00,1390.00,1417.00,2849.00,3988953.00,1389.00,28.00
