S.N.,Traded Companies,No. Of Transaction,Max Price,Min Price,Closing Price,Traded Shares,Amount,Previous Closing,Difference Rs.
1,Agricultural Development Bank Limited,51,442.00,430.00,431.00,6588.00,2837524.00,435.00,-4.00
2,Api Power Company Ltd.,34,493.00,478.00,486.00,1725.00,838619.00,485.00,1.00
3,Arun Kabeli Power Ltd.,37,360.00,351.00,356.00,1846.00,655129.00,358.00,-2.00
4,Arun Valley Hydropower Development Co. Ltd.,13,212.00,207.00,211.00,3545.00,745010.00,210.00,1.00
5,Asian Life Insurance Co. Limited,53,1485.00,1455.00,1485.00,4497.00,6622093.00,1440.00,45.00
6,Bank of Kathmandu Ltd.,66,410.00,406.00,409.00,12503.00,5095201.00,410.00,-1.00
7,Barun Hydropower Co. Ltd.,8,201.00,198.00,201.00,80.00,15890.00,200.00,1.00
8,Best Finance Company Ltd.,1,133.00,133.00,133.00,100.00,13300.00,134.00,-1.00
9,Bhargav Bikash Bank Ltd.,9,172.00,169.00,169.00,519.00,88373.00,173.00,-4.00
10,Bishal Bazar Company Limited,8,1916.00,1886.00,1916.00,385.00,734400.00,1915.00,1.00
11,Bottlers Nepal (Terai) Limited,2,5900.00,5900.00,5900.00,220.00,1298000.00,6020.00,-120.00
12,Butwal Power Company Limited,326,783.00,732.00,740.00,134904.00,100113840.00,725.00,15.00
13,Central Finance Co. Ltd.,6,185.00,182.00,184.00,1051.00,193786.00,184.00,0.00
14,Century Commercial Bank Ltd.,92,218.00,215.00,217.00,26048.00,5634421.00,216.00,1.00
15,Chhimek Laghubitta Bittiya Sanstha Limited,5,1130.00,1100.00,1130.00,563.00,624850.00,1100.00,30.00
16,Chhyangdi Hydropower Ltd.,27,186.00,180.00,186.00,365.00,66392.00,181.00,5.00
17,Chilime Hydropower Company Limited,51,938.00,932.00,935.00,10071.00,9414919.00,948.00,-13.00
18,Citizen Investment Trust,15,3630.00,3600.00,3601.00,752.00,2710899.00,3615.00,-14.00
19,Citizens Bank International Limited,63,301.00,297.00,298.00,45698.00,13661549.00,299.00,-1.00
20,City Express Finance Co. Limited,9,180.00,177.00,179.00,3970.00,711108.00,180.00,-1.00
21,Civil Bank Ltd,50,196.00,192.00,196.00,19250.00,3731762.00,194.00,2.00
22,Civil Laghubitta Bittiya Sanstha Ltd.,3,1032.00,1012.00,1032.00,45.00,45740.00,1030.00,2.00
23,Deprosc Laghubitta Bittiya Sanstha Limited,1,1146.00,1146.00,1146.00,13.00,14898.00,1150.00,-4.00
24,Deva Bikas Bank Limited,41,202.00,194.00,196.00,8118.00,1596051.00,199.00,-3.00
25,Dibyashwori Hydropower Ltd.,11,154.00,151.00,152.00,117.00,17795.00,149.00,3.00
26,Everest Bank Limited,103,1198.00,1190.00,1190.00,10825.00,12911026.00,1200.00,-10.00
27,Everest Insurance Co. Ltd.,11,2600.00,2591.00,2600.00,543.00,1411000.00,2605.00,-5.00
28,Excel Development Bank Ltd.,3,400.00,397.00,397.00,200.00,79520.00,405.00,-8.00
29,First Micro Finance Laghubitta Bittiya Sanstha Limited,50,892.00,872.00,884.00,6985.00,6181087.00,880.00,4.00
30,Forward Microfinance Laghubitta Bittiya Sanstha Limited,22,3536.00,3505.00,3532.00,576.00,2032195.00,3545.00,-13.00
31,Gandaki Bikas Bank Limited,9,269.00,264.00,266.00,770.00,204994.00,269.00,-3.00
32,Garima Bikas Bank Limited,14,244.00,240.00,244.00,3068.00,743131.00,243.00,1.00
33,Global IME Bank Limited,43,334.00,326.00,331.00,5453.00,1788740.00,328.00,3.00
34,Global IME Laghubitta Bittiya Sanstha Ltd.,10,1596.00,1565.00,1580.00,203.00,319242.00,1565.00,15.00
35,Global IME Samunnat Scheme-1,3,10.20,10.00,10.00,5000.00,50200.00,10.03,-0.03
36,Goodwill Finance Limited,12,180.00,172.00,180.00,2027.00,354604.00,172.00,8.00
37,Grameen Bikas Laghubitta Bittiya Sanstha Ltd.,262,725.00,705.00,725.00,4941.00,3530728.00,712.00,13.00
38,Green Development Bank Ltd.,11,577.00,571.00,576.00,364.00,208759.00,581.00,-5.00
39,Guheshowori Merchant Bank & Finance Co. Ltd.,1,190.00,190.00,190.00,135.00,25650.00,193.00,-3.00
40,Gurans Life Insurance Company Ltd.,23,1019.00,1000.00,1019.00,5144.00,5206824.00,1020.00,-1.00
41,Gurkhas Finance Ltd.,14,165.00,160.00,164.00,5193.00,841278.00,164.00,0.00
42,Hamro Bikas Bank Ltd.,8,186.00,183.00,185.00,2050.00,378600.00,186.00,-1.00
43,Hathway Finance Company Limited,4,165.00,163.00,163.00,160.00,26200.00,167.00,-4.00
44,Himalayan Bank Limited,14,880.00,865.00,871.00,1760.00,1531965.00,878.00,-7.00
45,Himalayan Distillery Limited,2,1287.00,1262.00,1287.00,60.00,76970.00,1238.00,49.00
46,Himalayan General Insurance Co. Ltd,13,650.00,645.00,648.00,941.00,609405.00,657.00,-9.00
47,Himalayan Power Partner Ltd.,505,435.00,410.00,425.00,23689.00,9939640.00,428.00,-3.00
48,Hydorelectricity Investment and Development Company Ltd,40,185.00,179.00,185.00,3315.00,603109.00,181.00,4.00
49,ICFC Finance Limited,6,225.00,220.00,224.00,10666.00,2387184.00,223.00,1.00
50,IME General Insurance Ltd.,7,1120.00,1090.00,1120.00,780.00,858200.00,1106.00,14.00
51,Janaki Finance Company Limited,3,240.00,236.00,236.00,142.00,33680.00,236.00,0.00
52,Janata Bank Nepal Ltd.,88,245.00,241.00,242.00,61955.00,15038385.00,243.00,-1.00
53,Janata Bank Nepal Ltd. Promoter Share,9,150.00,150.00,150.00,42360.00,6354000.00,150.00,0.00
54,Janautthan Samudayic Laghubitta Bittya Sanstha Limited,13,3835.00,3750.00,3775.00,310.00,1164920.00,3760.00,15.00
55,Jebils Finance Ltd.,4,138.00,134.00,134.00,386.00,52024.00,140.00,-6.00
56,Jyoti Bikas Bank Limited,12,185.00,182.00,184.00,1100.00,202162.00,185.00,-1.00
57,Kailash Bikas Bank Ltd.,4,244.00,240.00,244.00,1713.00,413520.00,240.00,4.00
58,Kalika Laghubitta Bittiya Sanstha Ltd,12,1836.00,1768.00,1836.00,1214.00,2195460.00,1800.00,36.00
59,Kamana Sewa Bikas Bank Limited,22,198.00,193.00,194.00,3183.00,617246.00,196.00,-2.00
60,Kankai Bikas Bank Ltd.,26,172.00,168.00,171.00,5171.00,876650.00,170.00,1.00
61,Karnali Development Bank Limited,3,290.00,286.00,286.00,320.00,91600.00,295.00,-9.00
62,Khanikhola Hydropower Co. Ltd.,15,158.00,155.00,157.00,192.00,30200.00,157.00,0.00
63,Kisan Lagubitta Bittiya Sanstha Limited,7,2350.00,2284.00,2350.00,339.00,793698.00,2330.00,20.00
64,Kumari Bank Limited,47,307.00,302.00,305.00,15284.00,4650744.00,307.00,-2.00
65,Lalitpur Finance Ltd.,1,172.00,172.00,172.00,250.00,43000.00,169.00,3.00
66,Laxmi Bank Limited,19,284.00,280.00,284.00,10862.00,3073228.00,285.00,-1.00
67,Laxmi Equity Fund,3,10.05,10.05,10.05,5000.00,50250.00,10.10,-0.05
68,Laxmi Laghubitta Bittiya Sanstha Ltd.,21,1340.00,1301.00,1319.00,1289.00,1694514.00,1350.00,-31.00
69,Laxmi Value Fund-1,6,11.83,11.60,11.80,14200.00,167180.00,11.60,0.20
70,Life Insurance Corporation (Nepal) Limited,7,2070.00,2035.00,2070.00,261.00,532035.00,2035.00,35.00
71,Lumbini Bikas Bank Ltd.,18,202.00,196.00,199.00,1379.00,273016.00,198.00,1.00
72,Lumbini General Insurance Co. Ltd.,30,795.00,783.00,795.00,5833.00,4592635.00,798.00,-3.00
73,Machhapuchhre Bank Limited,49,290.00,285.00,288.00,16904.00,4836049.00,290.00,-2.00
74,Mahalaxmi Bikas Bank Ltd.,20,212.00,208.00,208.00,2384.00,496632.00,211.00,-3.00
75,Mahila Sahayatra Microfinance Bittiya Sanstha Ltd.,5,975.00,965.00,970.00,160.00,154675.00,980.00,-10.00
76,Manjushree Finance Ltd.,17,146.00,143.00,146.00,3071.00,444208.00,144.00,2.00
77,Mero Microfinance Bittiya Sanstha Ltd.,4,1451.00,1430.00,1430.00,211.00,305830.00,1452.00,-22.00
78,Mirmire Microfinance Development Bank Ltd.,17,3089.00,3020.00,3089.00,654.00,1998728.00,3000.00,89.00
79,Miteri Development Bank Limited,1,500.00,500.00,500.00,40.00,20000.00,500.00,0.00
80,Mithila LaghuBitta Bittiya Sanstha Limited,25,1345.00,1285.00,1315.00,794.00,1042827.00,1260.00,55.00
81,Muktinath Bikas Bank Ltd.,27,596.00,580.00,596.00,5156.00,3002542.00,587.00,9.00
82,Muktinath Bikas Bank Ltd. Promoter Share,1,463.00,463.00,463.00,8500.00,3935500.00,463.00,0.00
83,Multipurpose Finance Company  Limited,1,0.00,0.00,0.00,1.00,300.00,300.00,0.00
84,Nabil Bank Limited,42,1170.00,1155.00,1170.00,4113.00,4771619.00,1166.00,4.00
85,NABIL Bank Limited Promotor Share,13,873.00,865.00,873.00,10072.00,8722570.00,873.00,0.00
86,Nabil Equity Fund,2,10.13,10.10,10.13,4828.00,48835.22,10.15,-0.02
87,NagBeli LaghuBitta Bikas Bank Ltd.,3,2801.00,2800.00,2801.00,38.00,106410.00,2820.00,-19.00
88,National Hydro Power Company Limited,10,125.00,121.00,125.00,2550.00,313300.00,125.00,0.00
89,National Life Insurance Co. Ltd.,19,1685.00,1678.00,1679.00,1508.00,2535424.00,1695.00,-16.00
90,National Microfinance Laghubitta Bittiya Sanstha Limited,10,2615.00,2590.00,2600.00,142.00,368907.00,2600.00,0.00
91,Naya Sarathi Laghubitta Bittiya Sanstha Limited,12,3060.00,3001.00,3060.00,670.00,2042610.00,3020.00,40.00
92,Neco Insurance Limited,27,947.00,930.00,935.00,3293.00,3074554.00,941.00,-6.00
93,Nepal Bangladesh Bank Limited,42,291.00,289.00,291.00,9433.00,2739204.00,291.00,0.00
94,Nepal Bank Limited,70,377.00,373.00,377.00,49928.00,18720209.00,376.00,1.00
95,Nepal Community Development Bank Ltd.,1,163.00,163.00,163.00,200.00,32600.00,161.00,2.00
96,Nepal Credit And Commercial Bank Limited,62,367.00,360.00,363.00,15988.00,5793924.00,365.00,-2.00
97,Nepal Doorsanchar Company Limited,36,899.00,882.00,893.00,10685.00,9507065.00,899.00,-6.00
98,Nepal Hydro Developers Ltd.,42,254.00,251.00,253.00,420.00,106220.00,255.00,-2.00
99,Nepal Insurance Co. Ltd.,22,1445.00,1418.00,1445.00,6285.00,8936394.00,1431.00,14.00
100,Nepal Investment Bank Limited,80,675.00,666.00,675.00,10378.00,6979135.00,674.00,1.00
101,Nepal Investment Bank Ltd. Promoter Share,7,587.00,578.00,587.00,2235.00,1298630.00,586.00,1.00
102,Nepal Life Insurance Co. Ltd.,96,1895.00,1880.00,1890.00,5499.00,10379111.00,1890.00,0.00
103,Nepal SBI Bank Limited,51,740.00,730.00,735.00,10016.00,7328305.00,736.00,-1.00
104,Nerude Laghubitta Bittiya Sanstha Limited,8,1029.00,1000.00,1024.00,539.00,548632.00,1013.00,11.00
105,Ngadi Group Power Ltd.,11,260.00,245.00,255.00,392.00,97576.00,255.00,0.00
106,NIBL Pragati Fund,8,10.05,9.90,10.05,11212.00,111933.20,9.86,0.19
107,NIBL Samriddhi Fund 1,1,11.96,11.96,11.96,2500.00,29900.00,12.12,-0.16
108,NIC Asia Bank Ltd.,37,365.00,358.00,363.00,9511.00,3430554.00,361.00,2.00
109,Nirdhan Utthan Laghubitta Bittiya Sanstha Limited,9,2300.00,2295.00,2300.00,480.00,1102900.00,2290.00,10.00
110,NLG Insurance Company Ltd.,11,1493.00,1485.00,1490.00,1761.00,2622540.00,1497.00,-7.00
111,NMB  Microfinance Bittiya Sanstha Ltd.,17,2050.00,2015.00,2050.00,974.00,1970943.00,2015.00,35.00
112,NMB Bank Limited,50,487.00,483.00,484.00,7749.00,3761290.00,490.00,-6.00
113,NMB Hybrid Fund L-1,7,10.20,10.01,10.20,16193.00,162640.27,10.30,-0.10
114,NMB Sulav Investment Fund-1,2,13.39,13.30,13.39,5915.00,79021.85,13.38,0.01
115,Om Development Bank Ltd.,47,265.00,258.00,258.00,29390.00,7630500.00,264.00,-6.00
116,Oriental Hotels Limited,4,718.00,691.00,691.00,180.00,125620.00,704.00,-13.00
117,Pokhara Finance Ltd.,5,217.00,212.00,212.00,153.00,32736.00,214.00,-2.00
118,Prabhu  Bank Limited,65,360.00,350.00,353.00,8842.00,3116788.00,353.00,0.00
119,Prabhu Insurance Ltd.,33,901.00,890.00,895.00,4400.00,3923270.00,898.00,-3.00
120,Premier Insurance Company (Nepal) Limited,27,1619.00,1545.00,1545.00,3711.00,5841211.00,1557.00,-12.00
121,Prime Commercial Bank Ltd.,73,440.00,436.00,438.00,12865.00,5636772.00,438.00,0.00
122,Prime Life Insurance Company Limited,17,1885.00,1848.00,1874.00,1388.00,2597261.00,1862.00,12.00
123,Prime Life Insurance Company Limited Promoter Share,1,950.00,950.00,950.00,65000.00,61750000.00,950.00,0.00
124,Progressive Finance Limited,1,229.00,229.00,229.00,50.00,11450.00,225.00,4.00
125,Prudential Insurance Co. Ltd.,9,945.00,931.00,935.00,1014.00,953962.00,945.00,-10.00
126,Rastriya Beema Company Limited,15,15480.00,15200.00,15480.00,295.00,4527785.00,15198.00,282.00
127,Rastriya Beema Company Limited Promoter Share,16,14480.00,14100.00,14400.00,305.00,4368580.00,14315.00,85.00
128,Reliance Finance Ltd.,8,155.00,151.00,151.00,1200.00,183000.00,158.00,-7.00
129,Ridi Hydropower Development Company Ltd.,18,161.00,157.00,161.00,1413.00,226655.00,163.00,-2.00
130,RMDC Laghubitta Bittiya Sanstha Ltd.,22,739.00,732.00,737.00,2730.00,2006500.00,736.00,1.00
131,RSDC Laghubitta Bittiya Sanstha Ltd.,9,1305.00,1287.00,1300.00,266.00,345842.00,1295.00,5.00
132,Sagarmatha Insurance Co. Ltd.,7,1460.00,1415.00,1455.00,272.00,393025.00,1437.00,18.00
133,Sahayogi Bikas Bank Limited,7,288.00,285.00,286.00,1087.00,311447.00,287.00,-1.00
134,Sana Kisan Bikas Laghubitta Bittiya Sanstha Limited,14,1210.00,1188.00,1210.00,2122.00,2558384.00,1215.00,-5.00
135,Sanima Bank Limited,114,359.00,349.00,350.00,36473.00,12805210.00,356.00,-6.00
136,Sanima Mai Hydropower Ltd.,26,549.00,533.00,538.00,6575.00,3560216.00,554.00,-16.00
137,Saptakoshi Development Bank Ltd.,6,172.00,169.00,170.00,242.00,41161.00,171.00,-1.00
138,Shangrila Development Bank Ltd.,53,355.00,350.00,355.00,7168.00,2522818.00,352.00,3.00
139,Shikhar Insurance Co. Ltd.,208,1795.00,1750.00,1750.00,22652.00,39833411.00,1770.00,-20.00
140,Shine Resunga Development Bank Ltd.,12,413.00,406.00,406.00,1492.00,610750.00,408.00,-2.00
141,Shree Investment Finance Co. Ltd.,11,450.00,442.00,449.00,559.00,249672.00,441.00,8.00
142,Shrijana Finance  (Bittaya Sanstha),9,474.00,454.00,474.00,297.00,137588.00,466.00,8.00
143,Siddhartha Bank Limited,31,400.00,392.00,393.00,5995.00,2360298.00,396.00,-3.00
144,Siddhartha Equity Orineted Scheme,3,12.90,12.84,12.84,6000.00,77340.00,12.65,0.19
145,Siddhartha Insurance Ltd.,15,1120.00,1110.00,1110.00,1524.00,1698908.00,1115.00,-5.00
146,Siddhartha Investment Growth Scheme-1,2,21.14,20.72,20.72,10000.00,209300.00,20.73,-0.01
147,Sindhu Bikash Bank Ltd,8,182.00,177.00,177.00,1013.00,181091.00,185.00,-8.00
148,Soaltee Hotel Limited,6,282.00,278.00,280.00,3439.00,962220.00,282.00,-2.00
149,Standard Chartered Bank Limited,135,2120.00,2094.00,2115.00,5423.00,11407824.00,2114.00,1.00
150,Summit Laghubitta Bittiya Sanstha Limited,5,1890.00,1885.00,1885.00,191.00,360625.00,1920.00,-35.00
151,Sunrise Bank Limited,40,280.00,277.00,279.00,7918.00,2201050.00,280.00,-1.00
152,Surya Life Insurance Company Limited,32,1020.00,1001.00,1005.00,4131.00,4162925.00,1015.00,-10.00
153,Suryodaya Laghubitta Bittiya Sanstha Ltd.,1,1185.00,1185.00,1185.00,10.00,11850.00,1162.00,23.00
154,Suryodaya Womi Laghubitta Bittiya Sanstha Limited,6,1639.00,1614.00,1626.00,408.00,661983.00,1600.00,26.00
155,Swabalamban Laghubitta Bittiya Sanstha Limited,2,1395.00,1391.00,1395.00,600.00,835000.00,1400.00,-5.00
156,Swadeshi Laghubitta Bittiya Sanstha Ltd.,1,331.00,331.00,331.00,10.00,3310.00,325.00,6.00
157,Swarojgar Laghu Bitta Bikas Bank Ltd.,1,1800.00,1800.00,1800.00,15.00,27000.00,1800.00,0.00
158,Synergy Power Development Ltd.,91,184.00,170.00,182.00,9552.00,1712020.00,173.00,9.00
159,Taragaon Regency Hotel Limited,22,320.00,310.00,317.00,11550.00,3631850.00,314.00,3.00
160,Tinau Development Bank Limited,31,260.00,248.00,248.00,2636.00,663479.00,245.00,3.00
161,United Insurance Co. (Nepal) Ltd.,25,1301.00,1253.00,1271.00,1735.00,2200740.00,1276.00,-5.00
162,United Modi Hydropower Ltd.,44,275.00,267.00,271.00,3653.00,991034.00,275.00,-4.00
163,Vijaya laghubitta Bittiya Sanstha Ltd.,8,1030.00,1000.00,1020.00,418.00,420770.00,1030.00,-10.00
