S.N.,Traded Companies,No. Of Transaction,Max Price,Min Price,Closing Price,Traded Shares,Amount,Previous Closing,Difference Rs.
1,Agricultural Development Bank Limited,17,356.00,352.00,352.00,3083.00,1088481.00,354.00,-2.00
2,Api Power Company Ltd.,34,181.00,163.00,163.00,7292.00,1212386.00,181.00,-18.00
3,Arambha Microfinance Bittiya Sanstha Ltd.,26,890.00,853.00,853.00,1115.00,979505.00,890.00,-37.00
4,Arun Kabeli Power Ltd.,1,222.00,221.00,221.00,100.00,22100.00,222.00,-1.00
5,Arun Valley Hydropower Development Co. Ltd.,2,127.00,125.00,125.00,300.00,37568.00,125.00,2.00
6,Asian Life Insurance Co. Limited,1,570.00,569.00,569.00,49.00,27881.00,570.00,-1.00
7,Bank of Kathmandu Ltd.,17,320.00,316.00,317.00,2930.00,930340.00,320.00,-3.00
8,Butwal Power Company Limited,9,470.00,457.00,468.00,640.00,297050.00,470.00,-2.00
9,Century Commercial Bank Ltd.,7,192.00,185.00,186.00,736.00,136878.00,192.00,-6.00
10,Chhimek Laghubitta Bittiya Sanstha Limited,8,890.00,873.00,873.00,390.00,341027.00,890.00,-15.00
11,Chilime Hydropower Company Limited,17,700.00,690.00,691.00,1321.00,920913.00,700.00,-9.00
12,Citizens Bank International Limited,21,244.00,236.00,239.00,3940.00,939882.00,244.00,-5.00
13,Civil Bank Ltd,21,171.00,168.00,169.00,6710.00,1136170.00,171.00,-2.00
14,Civil Laghubitta Bittiya Sanstha Ltd.,2,665.00,660.00,665.00,20.00,13250.00,660.00,5.00
15,Deprosc Laghubitta Bittiya Sanstha Limited,7,652.00,640.00,639.00,314.00,202120.00,640.00,-1.00
16,Deva Bikas Bank Limited,9,137.00,134.00,135.00,4264.00,577938.00,134.00,1.00
17,Everest Bank Limited,31,599.00,580.00,585.00,7069.00,4174485.00,597.00,-12.00
18,Everest Insurance Co. Ltd.,14,1135.00,1105.00,1105.00,913.00,1022110.00,1120.00,-15.00
19,Excel Development Bank Ltd.,1,285.00,280.00,280.00,100.00,28000.00,285.00,-5.00
20,First Micro Finance Laghubitta Bittiya Sanstha Limited,5,376.00,370.00,372.00,450.00,166900.00,376.00,-4.00
21,Forward Microfinance Laghubitta Bittiya Sanstha Limited,2,2123.00,2043.00,2123.00,20.00,42050.00,2043.00,80.00
22,Gandaki Bikas Bank Limited,4,199.00,197.00,197.00,987.00,195339.00,199.00,-2.00
23,Garima Bikas Bank Limited,5,186.00,183.00,183.00,1000.00,183000.00,186.00,-3.00
24,Global IME Bank Limited,12,315.00,311.00,311.00,763.00,237603.00,315.00,-4.00
25,Global IME Laghubitta Bittiya Sanstha Ltd.,2,1167.00,1144.00,1144.00,20.00,22880.00,1167.00,-23.00
26,Global IME Samunnat Scheme-1,1,9.00,8.90,9.00,5000.00,45000.00,8.90,0.10
27,Grameen Bikas Laghubitta Bittiya Sanstha Ltd.,1,508.00,500.00,500.00,500.00,250000.00,508.00,-8.00
28,Green Development Bank Ltd.,5,118.00,117.00,117.00,1100.00,128700.00,118.00,-1.00
29,Gurans Life Insurance Company Ltd.,3,740.00,720.00,734.00,278.00,202860.00,740.00,-6.00
30,Gurkhas Finance Ltd.,1,108.00,106.00,108.00,10.00,1080.00,106.00,2.00
31,Himalayan Bank Limited,7,542.00,532.00,532.00,1030.00,550060.00,542.00,-10.00
32,Himalayan General Insurance Co. Ltd,4,401.00,395.00,395.00,570.00,227600.00,399.00,-4.00
33,Himalayan Power Partner Ltd.,7,226.00,218.00,223.00,270.00,59510.00,226.00,-3.00
34,Hydorelectricity Investment and Development Company Ltd,7,161.00,158.00,158.00,910.00,145280.00,161.00,-3.00
35,ICFC Finance Limited,3,160.00,155.00,157.00,824.00,131190.00,155.00,2.00
36,Janaki Finance Company Limited,1,170.00,167.00,170.00,275.00,46750.00,167.00,3.00
37,Janata Bank Nepal Ltd.,31,186.00,183.00,184.00,8678.00,1599733.00,185.00,-1.00
38,Jyoti Bikas Bank Limited,5,138.00,136.00,138.00,2009.00,274832.00,136.00,2.00
39,Kailash Bikas Bank Ltd.,7,244.00,240.00,242.00,4044.00,975736.00,244.00,-2.00
40,Kalika Laghubitta Bittiya Sanstha Ltd,2,1080.00,1041.00,1080.00,40.00,42630.00,1041.00,39.00
41,Kalika power Company Ltd,65,114.00,112.00,113.00,1330.00,150130.00,113.00,0.00
42,Kamana Sewa Bikas Bank Limited,39,146.00,142.00,144.00,29876.00,4321844.00,144.00,0.00
43,Kankai Bikas Bank Ltd.,1,130.00,130.00,130.00,3.00,390.00,130.00,0.00
44,Kisan Lagubitta Bittiya Sanstha Limited,7,1142.00,1098.00,1098.00,230.00,258010.00,1142.00,-44.00
45,Kumari Bank Limited,48,256.00,250.00,251.00,11390.00,2861428.00,253.00,-2.00
46,Laxmi Laghubitta Bittiya Sanstha Ltd.,1,884.00,867.00,884.00,50.00,44200.00,867.00,17.00
47,Lumbini Bikas Bank Ltd.,20,170.00,166.00,168.00,4947.00,832917.00,169.00,0.00
48,Lumbini General Insurance Co. Ltd.,2,507.00,500.00,500.00,225.00,112500.00,507.00,-7.00
49,Machhapuchhre Bank Limited,26,222.00,220.00,221.00,10571.00,2338516.00,221.00,1.00
50,Mahalaxmi Bikas Bank Ltd.,1,178.00,175.00,175.00,200.00,35000.00,178.00,-3.00
51,Mahuli Laghubitta Bittiya Sanstha Limited,7,2392.00,2280.00,2392.00,95.00,219580.00,2319.00,73.00
52,Mega  Bank Nepal Ltd.,30,199.00,195.00,196.00,5231.00,1025165.00,199.00,-3.00
53,Mero Microfinance Bittiya Sanstha Ltd.,3,1050.00,1045.00,1045.00,70.00,73350.00,1050.00,-5.00
54,Mirmire Microfinance Development Bank Ltd.,3,1250.00,1220.00,1220.00,130.00,159700.00,1245.00,-25.00
55,Miteri Development Bank Limited,2,281.00,274.00,281.00,80.00,22230.00,274.00,7.00
56,Muktinath Bikas Bank Ltd.,12,405.00,401.00,401.00,5631.00,2262531.00,405.00,-4.00
57,Nabil Bank Limited,31,946.00,897.00,911.00,2235.00,2049703.00,946.00,-35.00
58,NABIL Bank Limited Promotor Share,1,749.00,740.00,740.00,250.00,185000.00,749.00,-9.00
59,Nadep Laghubittiya bittya Sanstha Ltd.,46,1460.00,1432.00,1434.00,590.00,847960.00,1460.00,-25.00
60,NagBeli LaghuBitta Bikas Bank Ltd.,1,900.00,895.00,895.00,17.00,15215.00,900.00,-5.00
61,National Hydro Power Company Limited,3,79.00,78.00,78.00,550.00,42900.00,79.00,-1.00
62,National Life Insurance Co. Ltd.,6,703.00,690.00,690.00,600.00,419650.00,700.00,-10.00
63,National Microfinance Laghubitta Bittiya Sanstha Limited,2,1935.00,1900.00,1915.00,126.00,243390.00,1900.00,15.00
64,Neco Insurance Limited,4,520.00,510.00,510.00,802.00,412520.00,520.00,-10.00
65,Nepal Bangladesh Bank Limited,9,213.00,207.00,207.00,1544.00,323408.00,213.00,-6.00
66,Nepal Bank Limited,52,302.00,294.00,295.00,27671.00,8216195.00,301.00,-6.00
67,Nepal Community Development Bank Ltd.,1,127.00,126.00,126.00,25.00,3150.00,127.00,-1.00
68,Nepal Credit And Commercial Bank Limited,19,214.00,210.00,210.00,4324.00,914085.00,214.00,-4.00
69,Nepal Doorsanchar Company Limited,12,797.00,780.00,785.00,3595.00,2813050.00,782.00,3.00
70,Nepal Insurance Co. Ltd.,4,528.00,519.00,519.00,600.00,312420.00,528.00,-9.00
71,Nepal Investment Bank Limited,42,635.00,625.00,628.00,4341.00,2727507.00,635.00,-7.00
72,Nepal Investment Bank Ltd. Promoter Share,6,580.00,570.00,570.00,442.00,253160.00,580.00,-10.00
73,Nepal Life Insurance Co. Ltd.,20,936.00,921.00,925.00,1191.00,1101901.00,936.00,-11.00
74,Nepal SBI Bank Limited,9,485.00,470.00,471.00,977.00,465324.00,484.00,-13.00
75,Nerude Laghubitta Bittiya Sanstha Limited,11,560.00,540.00,540.00,924.00,507530.00,550.00,-10.00
76,NIC Asia Bank Ltd.,42,431.00,410.00,416.00,19111.00,7958513.00,423.00,-5.00
77,NLG Insurance Company Ltd.,1,872.00,870.00,870.00,100.00,87000.00,872.00,-2.00
78,NMB  Microfinance Bittiya Sanstha Ltd.,2,1415.00,1387.00,1387.00,50.00,69350.00,1415.00,-28.00
79,NMB Bank Limited,31,354.00,349.00,349.00,5503.00,1928827.00,354.00,-5.00
80,Oriental Hotels Limited,4,438.00,419.00,419.00,1000.00,428650.00,438.00,-19.00
81,Panchakanya Mai Hydropower Ltd,34,124.00,122.00,123.00,340.00,41730.00,124.00,-1.00
82,Pokhara Finance Ltd.,1,139.00,139.00,139.00,31.00,4309.00,139.00,0.00
83,Prabhu  Bank Limited,78,256.00,249.00,249.00,34964.00,8804665.00,255.00,-6.00
84,Prabhu Insurance Ltd.,12,470.00,456.00,460.00,921.00,427136.00,460.00,0.00
85,Premier Insurance Company (Nepal) Limited,8,1090.00,1050.00,1050.00,139.00,148109.00,1083.00,-33.00
86,Prime Commercial Bank Ltd.,35,335.00,324.00,326.00,12429.00,4077602.00,335.00,-9.00
87,Prime Life Insurance Company Limited,5,481.00,472.00,473.00,250.00,119000.00,475.00,-2.00
88,Prudential Insurance Co. Ltd.,5,734.00,715.00,715.00,631.00,460290.00,721.00,-6.00
89,Rairang Hydropower Development Company Ltd.,7,111.00,105.00,108.00,70.00,7480.00,111.00,-3.00
90,Rastriya Beema Company Limited,6,9705.00,9700.00,9700.00,100.00,970100.00,9700.00,0.00
91,Rastriya Beema Company Limited Promoter Share,1,8767.00,8700.00,8700.00,35.00,304500.00,8767.00,-67.00
92,Reliance Finance Ltd.,1,125.00,123.00,125.00,20.00,2500.00,123.00,2.00
93,Ridi Hydropower Development Company Ltd.,2,104.00,102.00,104.00,1000.00,103000.00,104.00,0.00
94,RMDC Laghubitta Bittiya Sanstha Ltd.,1,621.00,620.00,621.00,100.00,62100.00,620.00,1.00
95,RSDC Laghubitta Bittiya Sanstha Ltd.,3,425.00,417.00,419.00,39.00,16377.00,425.00,-6.00
96,Sagarmatha Insurance Co. Ltd.,2,1356.00,1340.00,1340.00,100.00,134624.00,1356.00,-16.00
97,Sahayogi Bikas Bank Limited,2,216.00,208.00,208.00,400.00,83400.00,216.00,-8.00
98,Sana Kisan Bikas Laghubitta Bittiya Sanstha Limited,9,1098.00,1077.00,1088.00,1106.00,1200242.00,1098.00,-10.00
99,Sanima Bank Limited,33,327.00,320.00,322.00,9311.00,3014931.00,327.00,-6.00
100,Sanima Equity Fund,1,9.25,9.08,9.00,10000.00,90800.00,9.25,-0.17
101,Sanima Mai Hydropower Ltd.,5,254.00,249.00,249.00,1500.00,373740.00,252.00,-3.00
102,Saptakoshi Development Bank Ltd.,1,116.00,114.00,114.00,1.00,114.00,116.00,-2.00
103,Shangrila Development Bank Ltd.,2,150.00,149.00,150.00,1177.00,175550.00,150.00,0.00
104,Shikhar Insurance Co. Ltd.,3,891.00,880.00,880.00,100.00,88490.00,890.00,-10.00
105,Shine Resunga Development Bank Ltd.,3,239.00,236.00,236.00,1000.00,236000.00,239.00,-3.00
106,Siddhartha Bank Limited,20,334.00,325.00,327.00,3645.00,1195769.00,334.00,-7.00
107,Siddhartha Insurance Ltd.,4,664.00,645.00,645.00,260.00,168430.00,657.00,-12.00
108,Sindhu Bikash Bank Ltd,2,117.00,115.00,117.00,77.00,8955.00,117.00,0.00
109,Soaltee Hotel Limited,1,253.00,248.00,248.00,500.00,124000.00,253.00,-5.00
110,Standard Chartered Bank Limited,99,690.00,621.00,632.00,11703.00,7390247.00,690.00,-59.00
111,Sunrise Bank Limited,8,239.00,235.00,237.00,2383.00,568469.00,239.00,-1.00
112,Support Microfinance Bittiya Sanstha Ltd.,1,744.00,730.00,744.00,10.00,7440.00,730.00,14.00
113,Surya Life Insurance Company Limited,13,511.00,500.00,502.00,1281.00,642300.00,511.00,-9.00
114,Suryodaya Laghubitta Bittiya Sanstha Ltd.,7,1611.00,1579.00,1579.00,254.00,406202.00,1581.00,-2.00
115,Swabalamban Laghubitta Bittiya Sanstha Limited,8,1201.00,1156.00,1156.00,419.00,487052.00,1201.00,-45.00
116,Swadeshi Laghubitta Bittiya Sanstha Ltd.,2,705.00,681.00,705.00,110.00,76250.00,681.00,24.00
117,Swarojgar Laghu Bitta Bikas Bank Ltd.,3,613.00,601.00,613.00,280.00,169040.00,611.00,2.00
118,Taragaon Regency Hotel Limited,1,265.00,265.00,265.00,50.00,13250.00,265.00,0.00
119,Tinau Development Bank Limited,1,177.00,176.00,177.00,50.00,8850.00,176.00,1.00
120,United Finance Ltd.,1,174.00,171.00,171.00,100.00,17100.00,174.00,-3.00
121,United Insurance Co. (Nepal) Ltd.,3,790.00,782.00,782.00,140.00,109800.00,784.00,-2.00
122,United Modi Hydropower Ltd.,3,146.00,145.00,145.00,89.00,12980.00,146.00,-1.00
123,Unnati Sahakarya Laghubitta Bittiya Sanstha Limited,5,1620.00,1570.00,1601.00,90.00,143150.00,1620.00,-19.00
124,Vijaya laghubitta Bittiya Sanstha Ltd.,2,682.00,670.00,670.00,41.00,27470.00,682.00,-12.00
125,Wean Nepal Laghubitta Bittiya Sanstha Limited,35,756.00,715.00,721.00,360.00,260720.00,756.00,-37.00
