S.N.,Traded Companies,No. Of Transaction,Max Price,Min Price,Closing Price,Traded Shares,Amount,Previous Closing,Difference Rs.
1,Agricultural Development Bank Limited,61,413.00,406.00,407.00,11120.00,4556249.00,413.00,-6.00
2,Ankhu Khola Jalvidhyut Company Ltd,31,75.00,70.00,73.00,1120.00,82800.00,72.00,1.00
3,Api Power Company Ltd.,29,145.00,142.00,144.00,5362.00,768241.00,145.00,-1.00
4,Arun Kabeli Power Ltd.,16,189.00,183.00,189.00,1489.00,278713.00,183.00,6.00
5,Arun Valley Hydropower Development Co. Ltd.,56,106.00,102.00,104.00,35200.00,3642065.00,108.00,-4.00
6,Asha Laghubitta Bittiya Sanstha Ltd,62,408.00,389.00,395.00,620.00,242760.00,401.00,-6.00
7,Asian Life Insurance Co. Limited,19,388.00,375.00,380.00,2778.00,1050228.00,395.00,-15.00
8,Bank of Kathmandu Ltd.,74,265.00,260.00,261.00,20561.00,5370434.00,265.00,-4.00
9,Barun Hydropower Co. Ltd.,6,91.00,90.00,90.00,70.00,6310.00,92.00,-2.00
10,Best Finance Company Ltd.,11,104.00,102.00,103.00,4000.00,411500.00,105.00,-2.00
11,Bottlers Nepal (Terai) Limited,2,6600.00,6475.00,6600.00,60.00,389750.00,6474.00,126.00
12,Butwal Power Company Limited,64,403.00,395.00,395.00,6625.00,2641400.00,405.00,-10.00
13,Central Finance Co. Ltd.,6,120.00,118.00,118.00,1650.00,195800.00,117.00,1.00
14,Century Commercial Bank Ltd.,103,168.00,165.00,166.00,21195.00,3517339.00,167.00,-1.00
15,Chhimek Laghubitta Bittiya Sanstha Limited,34,945.00,934.00,935.00,3433.00,3215496.00,935.00,0.00
16,Chhyangdi Hydropower Ltd.,9,91.00,91.00,91.00,114.00,10374.00,92.00,-1.00
17,Chilime Hydropower Company Limited,40,510.00,504.00,504.00,5181.00,2622428.00,508.00,-4.00
18,Citizen Investment Trust,25,2465.00,2450.00,2455.00,1040.00,2557065.00,2475.00,-20.00
19,Citizens Bank International Limited,90,229.00,220.00,220.00,22615.00,5000999.00,221.00,-1.00
20,Citizens Mutual Fund -1,8,9.65,9.47,9.47,6400.00,60804.00,9.65,-0.18
21,Civil Bank Ltd,147,147.00,143.00,144.00,79358.00,11457137.00,145.00,-1.00
22,Civil Laghubitta Bittiya Sanstha Ltd.,11,513.00,494.00,513.00,171.00,86010.00,502.00,11.00
23,Corporate Development Bank Limited,6,120.00,117.00,117.00,600.00,70860.00,120.00,-3.00
24,Deprosc Laghubitta Bittiya Sanstha Limited,19,707.00,705.00,705.00,5260.00,3710784.00,706.00,-1.00
25,Deva Bikas Bank Limited,23,138.00,137.00,137.00,7724.00,1060238.00,138.00,-1.00
26,Dibyashwori Hydropower Ltd.,4,68.00,68.00,68.00,907.00,61676.00,67.00,1.00
27,Everest Bank Limited,56,665.00,653.00,653.00,11001.00,7272899.00,663.00,-10.00
28,Everest Insurance Co. Ltd.,5,364.00,357.00,362.00,194.00,70448.00,371.00,-9.00
29,First Micro Finance Laghubitta Bittiya Sanstha Limited,15,381.00,376.00,377.00,1819.00,688974.00,384.00,-7.00
30,Forward Microfinance Laghubitta Bittiya Sanstha Limited,37,1340.00,1310.00,1314.00,988.00,1300459.00,1330.00,-16.00
31,Ganapati Laghubitta Bittiya Sanstha Limited,408,443.00,422.00,432.00,7780.00,3358900.00,436.00,-4.00
32,Gandaki Bikas Bank Limited,20,210.00,207.00,207.00,12578.00,2624096.00,210.00,-3.00
33,Garima Bikas Bank Limited,33,222.00,220.00,220.00,10070.00,2223028.00,221.00,-1.00
34,Ghalemdi Hydro Limited,8,81.00,79.00,81.00,190.00,15090.00,80.00,1.00
35,Global IME Bank Limited,103,303.00,299.00,299.00,28909.00,8678811.00,304.00,-5.00
36,Global IME Bank Ltd. Promoter Share,3,173.00,173.00,173.00,600000.00,103800000.00,173.00,0.00
37,Global IME Laghubitta Bittiya Sanstha Ltd.,6,1220.00,1196.00,1200.00,85.00,101900.00,1220.00,-20.00
38,Global IME Samunnat Scheme-1,4,7.84,7.84,7.84,3500.00,27440.00,8.00,-0.16
39,Goodwill Finance Limited,3,130.00,129.00,129.00,550.00,71000.00,130.00,-1.00
40,Grameen Bikas Laghubitta Bittiya Sanstha Ltd.,29,348.00,342.00,342.00,1620.00,558550.00,352.00,-10.00
41,Green Development Bank Ltd.,19,114.00,112.00,112.00,2675.00,301410.00,116.00,-4.00
42,Gurans Laghubitta Bittiya Sanstha Limited,229,410.00,380.00,381.00,3915.00,1512910.00,405.00,-24.00
43,Gurans Life Insurance Company Ltd.,10,475.00,466.00,466.00,1527.00,717723.00,477.00,-11.00
44,Gurkhas Finance Ltd.,4,119.00,117.00,118.00,1139.00,135492.00,121.00,-3.00
45,Himalaya Urja Bikas Company Limited,68,145.00,142.00,142.00,3730.00,532020.00,144.00,-2.00
46,Himalayan Bank Limited,17,553.00,548.00,548.00,1398.00,768132.00,553.00,-5.00
47,Himalayan Distillery Limited,78,1729.00,1675.00,1683.00,15360.00,26004730.00,1723.00,-40.00
48,Himalayan General Insurance Co. Ltd,6,353.00,351.00,351.00,440.00,155020.00,358.00,-7.00
49,Himalayan Power Partner Ltd.,21,180.00,176.00,177.00,521.00,93139.00,182.00,-5.00
50,Hydorelectricity Investment and Development Company Ltd,43,162.00,158.00,158.00,9018.00,1436599.00,161.00,-3.00
51,ICFC Finance Limited,5,162.00,160.00,160.00,555.00,89060.00,161.00,-1.00
52,IME General Insurance Ltd.,6,365.00,359.00,359.00,470.00,169030.00,362.86,-3.86
53,Janaki Finance Company Limited,2,174.00,174.00,174.00,174.00,30276.00,175.00,-1.00
54,Janata Bank Nepal Ltd.,113,209.00,206.00,207.00,35346.00,7318669.00,207.00,0.00
55,Janautthan Samudayic Laghubitta Bittya Sanstha Limited,10,1145.00,1113.00,1135.00,218.00,246512.00,1145.00,-10.00
56,Joshi Hydropower Development Company Ltd,46,82.00,79.00,81.00,860.00,69500.00,83.00,-2.00
57,Jyoti Bikas Bank Limited,27,155.00,154.00,154.00,6355.00,980609.00,155.00,-1.00
58,Kailash Bikas Bank Ltd.,5,231.00,230.00,231.00,2175.00,501425.00,233.00,-2.00
59,Kailash Bikas Bank Ltd. Promoter Share,1,128.00,128.00,128.00,10000.00,1280000.00,128.00,0.00
60,Kalika power Company Ltd,51,92.00,90.00,91.00,900.00,82450.00,93.00,-2.00
61,Kamana Sewa Bikas Bank Limited,12,155.00,154.00,154.00,3436.00,531764.00,156.00,-2.00
62,Kamana Sewa Bikas Bank Limited Promoter Share,1,105.00,105.00,105.00,6494.00,681870.00,105.00,0.00
63,Kanchan Development Bank Limited,2,193.00,193.00,193.00,60.00,11580.00,191.00,2.00
64,Karnali Development Bank Limited,6,117.00,113.00,117.00,360.00,40853.00,115.00,2.00
65,Khanikhola Hydropower Co. Ltd.,5,70.00,70.00,70.00,564.00,39480.00,70.00,0.00
66,Kumari Bank Limited,81,213.00,210.00,212.00,28209.00,5954508.00,212.00,0.00
67,Laxmi Bank Limited,50,221.00,219.00,219.00,19699.00,4328511.00,223.00,-4.00
68,Laxmi Equity Fund,4,7.70,7.70,7.70,5500.00,42350.00,7.75,-0.05
69,Laxmi Laghubitta Bittiya Sanstha Ltd.,5,651.00,650.00,650.00,530.00,344560.00,660.00,-10.00
70,Life Insurance Corporation (Nepal) Limited,7,1600.00,1571.00,1590.00,462.00,735347.00,1600.00,-10.00
71,Lumbini Bikas Bank Ltd.,35,196.00,193.00,193.00,10857.00,2111906.00,195.00,-2.00
72,Lumbini General Insurance Co. Ltd.,14,427.00,423.00,423.00,3313.00,1410576.00,427.00,-4.00
73,Machhapuchhre Bank Limited,36,266.00,263.00,264.00,6332.00,1672903.00,266.00,-2.00
74,Mahalaxmi Bikas Bank Ltd.,30,193.00,191.00,192.00,7661.00,1468211.00,192.00,0.00
75,Mahuli Laghubitta Bittiya Sanstha Limited,4,915.00,897.00,899.00,64.00,57452.00,915.00,-16.00
76,Mega  Bank Nepal Ltd.,103,201.00,198.00,200.00,43697.00,8718732.00,201.00,-1.00
77,Mega  Bank Nepal Ltd. Promoter Share,7,106.00,106.00,106.00,99460.00,10542760.00,108.00,-2.00
78,Mero Microfinance Bittiya Sanstha Ltd.,45,516.00,501.00,506.00,1852.00,947261.00,522.00,-16.00
79,Miteri Development Bank Limited,6,246.00,245.00,246.00,420.00,103230.00,250.00,-4.00
80,Mountain Hydro Nepal Limited,18,105.00,102.00,103.00,580.00,60090.00,104.00,-1.00
81,Muktinath Bikas Bank Ltd.,41,368.00,365.00,365.00,5893.00,2160213.00,368.00,-3.00
82,Multipurpose Finance Company  Limited,17,129.00,121.00,125.00,959.00,121847.00,119.00,6.00
83,Nabil Bank Limited,164,806.00,785.00,785.00,28406.00,22459703.00,800.00,-15.00
84,NABIL Bank Limited Promotor Share,13,785.00,780.00,780.00,2278.00,1780540.00,790.00,-10.00
85,Nabil Equity Fund,4,8.21,8.10,8.21,5573.00,45435.77,8.25,-0.04
86,Nadep Laghubittiya bittya Sanstha Ltd.,35,425.00,412.00,412.00,982.00,406946.00,418.00,-6.00
87,National Hydro Power Company Limited,8,67.00,66.00,66.00,3500.00,232900.00,68.00,-2.00
88,National Life Insurance Co. Ltd.,11,615.00,596.00,600.00,1277.00,767375.00,599.00,1.00
89,National Microfinance Laghubitta Bittiya Sanstha Limited,12,1450.00,1405.00,1420.00,400.00,571195.00,1460.00,-40.00
90,Naya Sarathi Laghubitta Bittiya Sanstha Limited,4,385.00,382.00,382.00,205.00,78895.00,388.00,-6.00
91,Neco Insurance Limited,23,470.00,464.00,464.00,3551.00,1655716.00,469.00,-5.00
92,Nepal Agro Laghubitta Bittiya Sanstha Limited,299,501.00,476.00,480.00,4048.00,1967132.00,501.00,-21.00
93,Nepal Bangladesh Bank Limited,92,225.00,219.00,220.00,38946.00,8593457.00,221.00,-1.00
94,Nepal Bank Limited,366,341.00,332.00,333.00,190259.00,63905944.00,335.00,-2.00
95,Nepal Credit And Commercial Bank Limited,265,251.00,244.00,246.00,132587.00,32575594.00,252.00,-6.00
96,Nepal Doorsanchar Company Limited,35,715.00,696.00,702.00,10990.00,7685545.00,703.00,-1.00
97,Nepal Hydro Developers Ltd.,9,126.00,123.00,123.00,90.00,11180.00,125.00,-2.00
98,Nepal Insurance Co. Ltd.,68,353.00,345.00,349.00,11238.00,3913455.00,356.00,-7.00
99,Nepal Investment Bank Limited,114,530.00,521.00,523.00,13646.00,7154456.00,527.00,-4.00
100,Nepal Investment Bank Ltd. Promoter Share,25,490.00,480.00,480.00,10240.00,4958149.00,491.00,-11.00
101,Nepal Life Insurance Co. Ltd.,114,895.00,873.00,875.00,6837.00,6015973.00,887.00,-12.00
102,Nepal SBI Bank Limited,31,465.00,460.00,465.00,7096.00,3288447.00,462.00,3.00
103,Nerude Laghubitta Bittiya Sanstha Limited,9,485.00,476.00,477.00,791.00,377170.00,481.00,-4.00
104,Ngadi Group Power Ltd.,11,116.00,115.00,115.00,1689.00,194257.00,116.00,-1.00
105,NIBL Pragati Fund,1,6.97,6.97,6.97,1000.00,6970.00,7.10,-0.13
106,NIBL Samriddhi Fund 1,1,9.35,9.35,9.35,100.00,935.00,9.30,0.05
107,NIC Asia Bank Ltd.,109,463.00,456.00,456.00,27859.00,12776566.00,463.00,-7.00
108,NIC Asia Growth Fund,4,9.50,9.36,9.50,5400.00,50958.00,9.55,-0.05
109,Nirdhan Utthan Laghubitta Bittiya Sanstha Limited,9,840.00,832.00,835.00,662.00,552276.00,835.00,0.00
110,NLG Insurance Company Ltd.,16,735.00,720.00,734.00,1992.00,1442684.00,741.00,-7.00
111,NMB  Microfinance Bittiya Sanstha Ltd.,7,985.00,970.00,970.00,115.00,111940.00,1005.00,-35.00
112,NMB Hybrid Fund L-1,2,9.30,9.30,9.30,2496.00,23212.80,9.30,0.00
113,NMB Sulav Investment Fund-1,1,10.65,10.65,10.65,5000.00,53250.00,10.75,-0.10
114,Oriental Hotels Limited,10,637.00,610.00,633.00,2066.00,1265802.00,636.00,-3.00
115,Panchakanya Mai Hydropower Ltd,48,107.00,105.00,105.00,970.00,102160.00,106.00,-1.00
116,Panchthar Power Compant Limited,98,148.00,135.00,142.00,2270.00,314160.00,141.00,1.00
117,Pokhara Finance Ltd.,17,140.00,138.00,138.00,158.00,21964.00,139.00,-1.00
118,Prabhu  Bank Limited,186,274.00,266.00,266.00,127427.00,34113520.00,269.00,-3.00
119,Prabhu Insurance Ltd.,26,382.00,365.00,365.00,2634.00,971741.00,375.00,-10.00
120,Premier Insurance Company (Nepal) Limited,150,999.00,950.00,957.00,8306.00,7988921.00,980.00,-23.00
121,Prime Commercial Bank Ltd.,99,283.00,275.00,275.00,27186.00,7612913.00,284.00,-9.00
122,Prime Life Insurance Company Limited,19,430.00,422.00,430.00,1928.00,817098.00,427.00,3.00
123,Progressive Finance Limited,3,110.00,109.00,109.00,3269.00,359399.00,110.00,-1.00
124,Prudential Insurance Co. Ltd.,14,570.00,543.00,543.00,1355.00,746660.00,563.00,-20.00
125,Radhi Bidyut Company Ltd,23,148.00,143.00,143.00,2578.00,376701.00,148.00,-5.00
126,Rairang Hydropower Development Company Ltd.,54,115.00,106.00,107.00,760.00,82360.00,115.00,-8.00
127,Rastriya Beema Company Limited,20,9307.00,9124.00,9124.00,340.00,3130980.00,9125.00,-1.00
128,Rastriya Beema Company Limited Promoter Share,12,8531.00,8456.00,8456.00,140.00,1192590.00,8600.00,-144.00
129,Reliance Finance Ltd.,9,133.00,126.00,126.00,561.00,71841.00,131.00,-5.00
130,Ridi Hydropower Development Company Ltd.,15,92.00,89.00,90.00,823.00,74121.00,93.00,-3.00
131,RMDC Laghubitta Bittiya Sanstha Ltd.,20,655.00,650.00,650.00,1739.00,1134284.00,650.00,0.00
132,RSDC Laghubitta Bittiya Sanstha Ltd.,35,350.00,341.00,343.00,2038.00,702089.00,350.00,-7.00
133,Sagarmatha Insurance Co. Ltd.,12,613.00,600.00,602.00,443.00,266868.00,613.00,-11.00
134,Samata Gharelu Laghubitta Bittiya Sanstha Limited,2,1140.00,1140.00,1140.00,2.00,2280.00,1140.00,0.00
135,Samriddhi Finance Company Limited,1,94.00,94.00,94.00,159.00,14946.00,95.00,-1.00
136,Samudayik Laghubitta Bittiya Sanstha Limited,17,520.00,508.00,520.00,200.00,102470.00,518.00,2.00
137,Sana Kisan Bikas Laghubitta Bittiya Sanstha Limited,27,947.00,929.00,934.00,3853.00,3593786.00,947.00,-13.00
138,Sanima Bank Limited,86,352.00,347.00,348.00,19871.00,6944917.00,350.00,-2.00
139,Sanima Equity Fund,4,9.54,9.36,9.54,5000.00,47055.00,9.51,0.03
140,Sanima Mai Hydropower Ltd.,35,248.00,244.00,244.00,20103.00,4918885.00,247.00,-3.00
141,Shangrila Development Bank Ltd.,22,153.00,150.00,150.00,9909.00,1502435.00,152.00,-2.00
142,Shikhar Insurance Co. Ltd.,40,740.00,726.00,730.00,4331.00,3170506.00,740.00,-10.00
143,Shine Resunga Development Bank Ltd.,13,258.00,251.00,251.00,1106.00,279531.00,259.00,-8.00
144,SHIVAM CEMENTS LTD,462,644.00,616.00,616.00,92576.00,58071455.00,644.00,-28.00
145,Shree Investment Finance Co. Ltd.,1,154.00,154.00,154.00,87.00,13398.00,155.00,-1.00
146,Shrijana Finance  (Bittaya Sanstha),1,218.00,218.00,218.00,210.00,45780.00,217.00,1.00
147,Siddhartha Bank Limited,119,322.00,316.00,320.00,83959.00,26674708.00,322.00,-2.00
148,Siddhartha Equity Fund,7,9.78,9.52,9.78,56100.00,545227.00,9.61,0.17
149,Siddhartha Equity Orineted Scheme,6,10.75,10.50,10.50,12252.00,129696.00,10.75,-0.25
150,Siddhartha Insurance Ltd.,15,446.00,424.00,433.00,1938.00,828128.00,438.00,-5.00
151,Sindhu Bikash Bank Ltd,8,139.00,135.00,135.00,3160.00,428090.00,141.00,-6.00
152,Soaltee Hotel Limited,9,235.00,232.00,234.00,2648.00,621466.00,234.00,0.00
153,Sparsha Laghubitta Bittiya Sanstha Limited,42,447.00,440.00,441.00,475.00,210980.00,453.00,-12.00
154,Standard Chartered Bank Limited,69,674.00,656.00,657.00,7343.00,4852022.00,664.00,-7.00
155,Sunrise Bank Limited,36,252.00,248.00,248.00,12613.00,3144597.00,252.00,-4.00
156,Support Microfinance Bittiya Sanstha Ltd.,2,404.00,404.00,404.00,50.00,20200.00,412.00,-8.00
157,Surya Life Insurance Company Limited,11,455.00,450.00,450.00,438.00,197429.00,450.00,0.00
158,Suryodaya Laghubitta Bittiya Sanstha Ltd.,9,710.00,699.00,699.00,181.00,126690.00,710.00,-11.00
159,Swabalamban Laghubitta Bittiya Sanstha Limited,17,915.00,880.00,880.00,2290.00,2031118.00,907.00,-27.00
160,Swabhimaan Laghubitta Bittiya Sanstha Limited,7,339.00,324.00,339.00,70.00,23460.00,309.00,30.00
161,Swadeshi Laghubitta Bittiya Sanstha Ltd.,21,566.00,556.00,559.00,1455.00,815788.00,566.00,-7.00
162,Synergy Power Development Ltd.,17,92.00,90.00,92.00,310.00,28140.00,91.00,1.00
163,Taragaon Regency Hotel Limited,28,309.00,302.00,304.00,9110.00,2775080.00,309.00,-5.00
164,Unilever Nepal Limited,1,19649.00,19649.00,19649.00,10.00,196490.00,19264.00,385.00
165,United Finance Ltd.,1,180.00,180.00,180.00,1000.00,180000.00,180.00,0.00
166,United Insurance Co. (Nepal) Ltd.,11,891.00,872.00,891.00,650.00,570050.00,887.00,4.00
167,United Modi Hydropower Ltd.,14,112.00,109.00,110.00,656.00,71801.00,110.00,0.00
168,UNIVERSAL POWER COMPANY LTD,35,92.00,90.00,91.00,3440.00,314730.00,92.00,-1.00
169,Unnati Sahakarya Laghubitta Bittiya Sanstha Limited,8,814.00,798.00,798.00,104.00,83196.00,830.00,-32.00
170,Upper Tamakoshi Hydropower Ltd,280,275.00,264.00,264.00,30280.00,8057805.00,267.00,-3.00
171,Vijaya laghubitta Bittiya Sanstha Ltd.,4,491.00,464.00,464.00,132.00,62598.00,482.00,-18.00
172,Wean Nepal Laghubitta Bittiya Sanstha Limited,5,400.00,397.00,400.00,70.00,27910.00,405.00,-5.00
